,oare_id,aligned_transliteration,aligned_translation,comment
823,12.0,[i-nu-mì URUDU il₅-qé-ú-ni 3 be-ru-ú li-ip-ta-num DUMU qar-da-a e-na-a-šur DUMU i-ku-pì-a-šur ù a-mur-{d}UTU DUMU pì-lá-aḫ-a-nim DU₁₀-a-šùr DUMU ili₅-pì-ú-ṣur ù IR-sú ḫu-du-be-lí i-na ša-ḫa-tí-šu-nu i-zi-zu],"When they received the copper 3 bēru, Liptānum son of Qardaya, Ennam-Aššur, son of Ikuppi-Aššur, and Amur-Šamaš, son of Pilah-Anum, (and) Ṭāb-Aššur, son of Ilī-pī-uṣur, and his slave Hudu-bēlī assisted them.",Text not preserved; reconstructed from HQ translation and parallel with silver section
824,13.0,[IGI e-na-a-šur DUMU e-na-a-šur IGI e-na-a-šur DUMU pì-lá-aḫ-IŠTAR],"In the presence of Ennam-Aššur, son of Ennam-Aššur, (and) of Ennam-Aššur, son of Pilah-Ištar.",Text not preserved; reconstructed from HQ translation
825,a793a223-aa10-411f-8240-a1fc160fcf12_0,i-dí-a-bu-um É-tí ša bu-ri-im a-šar ša-lim-a-šùr wa-áš-bu iš-tí tù-ud-ḫa-li-a a-ḫu tù-li iš-a-am,Iddin-abum has bought the houses by the well, where Šalim-Aššur is living
826,a793a223-aa10-411f-8240-a1fc160fcf12_1,a-na a-wa-tim a-ni-a-tim kà-ru-um kà-ni-iš i-dí-ni-a-tí-ma ṭup-pá-am ší-bu-tí-ni IGI GÍR ša a-šùr ni-dí-in,The Kanesh colony gave us for these proceedings, and we gave a tablet with our testimony before the dagger of Aššur.
827,a793a223-aa10-411f-8240-a1fc160fcf12_2,IGI a-ku-za IGI ú-ra-a IGI a-šùr-ba-ni,Witnessed by Akuza, by Uraya
828,a7dcac91-3a18-44f9-ae9e-ead1782db74a_0,17 ma-na LÁ 7.5 GÍN i-ṣé-er na-áb-sú-en i-sú-rik₁₃ i-šu iš-tù ḫa-mu-uš-tim ša sú-kà-li-a a-na 13 ḫa-am-ša-tim KÙ.BABBAR i-ša-qal,Nab-Suen owes 17 minas less 7.5 shekels (of silver) to Issu-arik. Reckoned from the week of Sukkalliya he must pay the silver in 13 weeks.,Interval extended slightly to include KÙ.BABBAR i-ša-qal which completes the payment clause
829,a7dcac91-3a18-44f9-ae9e-ead1782db74a_1,KÙ.BABBAR ù KÙ.GI i-na bi-ti-a i-ba-ší IGI en-nam-a-a IGI en-nam-a-šur DUMU da-da IGI a-šur-na-da DUMU a-mur-lu-ṣú,The silver and gold is in my house. Witnessed by Ennamaya by Ennam-Aššur son of Dada by Aššur-nādā son of Amur-luṣu.,Remainder of text covering the silver/gold in house clause and witness list
830,0.0,a-na en-nam-a-šur ú a-lá-ḫi-im qí-bi-ma um-ma SIG₅-pí-a-šur-ma,To Ennam-Aššur and Ali-aḫum from Damiq-pī-Aššur:,Standard letter opening formula
831,1.0,a-dí ma-lá ú ší-ni-šu tí-ir-tí i-li-kà-ku-nu-tí,Once or twice I sent word to you.,adī malā u šinīšu tīrtī ilikākunūti
832,2.0,a-na en-nam-a-šur qí-bi-ma,Say to Ennam-Aššur:,Segment break adjusted slightly from suggested interval
833,3.0,ta-áš-pu-ra-am,You wrote me.,Single verb form
834,4.0,um-ma a-ta-ma ṣú-ba-tu ša DAM.GÀR i-na ma-a-ma ú i-na ú-ni-ip-sí-im e-zi-ib-ma ILLAT-tum <gap>-šu 1 GÍN im-<gap>,You said: 'Leave the textiles belonging to the merchant in Mamma or in Unipsum and ... the caravan ... 1 shekel.',umma attāma introduces direct speech
835,5.0,i-nu-mì ILLAT-tum i-na ur-šu i-ma-ri-ú tí-ir-tí i-li-kà-ku-nu-tí,When the caravan slowed down in Uršu I sent word to you,
836,6.0,um-ma a-na-ku-ma mì-li-ik lu-qú-tim ša DAM.GÀR mì-il₅-kà,"saying: ""... counsel of the merchant's goods your counsel ...""",umma anākuma introduces reported speech; gap content uncertain
837,7.0,tí-ir-ta-ku-nu-ma ú-lá i-li-kam <gap>-tí <gap>-ú-tim <gap> ša DAM.GÀR <gap>-nim,your message and ... did not come ... of the merchant ...,Fragmentary segment with gaps
838,8.0,ki-ma ḫi-im-ṭá-tim ša DAM.GÀR áš-me-ú a ší-a-tí na-áš-pé-ra-tim ša DAM.GÀR ša a-lim{ki} ša na-áš-a-ku-nu-tí-ni PUZUR₄.IŠTAR na-áš-a-ku-nu-tí,As I heard the heated words of the merchant that is why Puzur-Ištar is bringing you the missives from the merchant in the City that I was to bring to you.,kīma ḫimṭātim = heated words; ašmêu triggers the result clause
839,9.0,a-ḫu-ú-a a-tù-nu i ša-am-ší na-áš-pé-ra-tim ta-áš-me-a-ni iḫ-da-ma a ma-lá na-áš-pé-ra-tim ep-ša-ma úz-ni ša DAM.GÀR pé-té-a,My dear brothers take care the very day you hear the missives you must act in accordance with the missives and inform the merchant.,aḫūʾa attunu = my dear brothers; iḫdama = take care/be diligent
840,10.0,<gap> tám-kà-ri-im <gap> lu-qú-tum <gap>,... of the merchant ... goods ...,Fragmentary closing lines
841,11.0,at be-lu-a <gap> lá tù-ša-lá <gap> ar-ta-ma <gap>-ša-ni <gap>,my lords ... do not question ...,lā tušallā = do not question/interrogate
842,a9836a99-7113-4fab-aace-9363e23415d3_0.0,KIŠIB kà-ri-im ḫa-ḫi-im,Sealed by the hahhum colony.,Interval adjusted from (0-3); covers the seal introduction with karim hahhim
843,a9836a99-7113-4fab-aace-9363e23415d3_1.0,kà-ru-um dí-nam i-dí-in-ma,The colony passed a verdict:,Interval (3-6) correct; karum dinam iddinma
844,a9836a99-7113-4fab-aace-9363e23415d3_2.0,šu-ma šu-be-lúm ù en-na-sú-in me-er-ú i-dí-a-bi₄-im lá i-li-ku-ú-ma iš-tí šál-ma-a-šùr lá i-na-me-ru-ú-ma a-li i-ma-gu₅-ru-ni lá e-ta-wu-ú lu-qú-tám a-na šál-ma-a-šùr ú-šu-ru-ú,"If Šu-Bēlum and Enna-Suen, Iddin-abum's sons, do not leave and meet with Šalim-Aššur and do not discuss in order to come to an agreement, then they must release the goods to Šalim-Aššur.",Interval (6-26) correct; full conditional clause
845,a9836a99-7113-4fab-aace-9363e23415d3_3.0,a-ba pá-šé-er a-wa-tim,Aba was the arbitrator.,Interval (26-29) correct; aba pašer awatim
846,a98af27f-70cc-4cb1-aaf0-b8e4bdff0764_0,2.5 ma-na ṣí-ba-ra-tum qá-dum ša a-bi₄-e-dim,2.5 minas of <gap> including those of Abi-wedum.,Interval (1-6) matches well
847,a98af27f-70cc-4cb1-aaf0-b8e4bdff0764_1,1.3333 ma-na a-na ú-ra-ḫa-zi ša,1.3333 mina for <gap>,Interval (7-11); 'ša' kept with segment 1 as it introduces the following gap
848,a98af27f-70cc-4cb1-aaf0-b8e4bdff0764_2,1 ma-na ul-ga-tim zi-ga-an-LUGAL 6 ma-na a-lu-li-tám ša 3.5 GÍN KÙ.BABBAR ša 10 GÍN KÙ.BABBAR AN.NA 8.5 GÍN KÙ.BABBAR a-na e-ma-ri-im 4.5 ma-na URUDU a-na qá-qá-da-tí-šu-nu 1 ma-na a-na a-a-ar-tim,For 1 mina <gap> zigan-sarru 6 minas alulitum worth 3.5 shekels of silver for 10 shekels of silver tin 8.5 shekels of silver for a donkey 4.5 minas of copper for their head-tax 1 mina for cowry shells.,Interval (12-41) matches well
849,a98af27f-70cc-4cb1-aaf0-b8e4bdff0764_3,mì-ma a-nim a-na a-šùr-ṣú-lu-li a-dí-in ša-bu,All this I gave to Assur-sululi he is satisfied.,Interval (42-47) matches well
850,a9c65a5b-a3b1-4fe0-89bb-279d33949ca8_0,a-na ša-lim-a-šùr a-šùr-ma-lik DUMU lu-zi-na ù i-ku-pí-a qí-bi-ma um-ma ší-ša-ra ù IŠTAR-lá-ma-sí-ma,"To Šalim-Aššur, Aššur-malik son of Luzina and Ikūn-pīya from Šišara and Ištar-lamassi:","Tokens 0-11; interval (0,12) confirmed correct"
851,a9c65a5b-a3b1-4fe0-89bb-279d33949ca8_1,i-na 2 GÚ 10 ma-na KÙ.BABBAR ša šu-bé-lim en-na-sú-in a-nu-li ù kà-ku-a MAŠKIM i-na kà-ni-iš a-na na-ru-qí-kà ú ma-la a-bu-kà i-ší-ma-tí-šu il₅-pu-tù-kà-ma ta-mì-ig-ra-ni 2 GÚ 10 ma-na KÙ.BABBAR ṣa-ru-pá-am i-na a-lim{ki} ša-qá-lá-am qá-bi-a-tí-ni ša-du-a-tám ni-is-ḫa-tim ša-lim-a-šùr ù-ma-lá ù KÙ.BABBAR a-šu-mì ša-lim-a-šùr GÁN-lam₅ e-tí-iq,"Of the 2 talents 10 minas of silver, on which you agreed (with?) Šu-Bēlum Enna-Suen, Anuli and Kakuwa, the attorney, for your joint-stock capital in Kanesh - also in accordance with what your father wrote for you in his will - (so that) you promised to pay 2 talents 10 minas of refined silver in the City - Šalim-Aššur will contribute the transport tariff and the import duty; also, the silver will cross overland in Šalim-Aššur's name -",Tokens 12-54; interval adjusted to include e-tí-iq (token 54) which completes the overland crossing clause
852,a9c65a5b-a3b1-4fe0-89bb-279d33949ca8_2,i-na KÙ.BABBAR a-nim 37.5 ma-na KÙ.BABBAR pí-lá-aḫ-IŠTAR DUMU ú-zu-a ub-lam 20 ma-na KÙ.BABBAR ḫi-na-a ub-lam 3 ma-na KÙ.BABBAR ku-zi-zi-a ub-lam 4 ma-na KÙ.BABBAR a-du-da ub-lam ší-tí KÙ.BABBAR 58.5 ma-na KÙ.BABBAR ṣa-ru-pu-um,out of this silver Pilah-Ištar son of Uzuwa brought 37.5 minas of silver; Hinnaya brought 20 minas of silver; Kuziziya brought 3 minas of silver; Aduda brought 4 minas of silver; the rest of the silver amounts to 58.5 minas of refined silver.,Tokens 55-85; segment starts at token 55 (i-na KÙ.BABBAR a-nim) rather than suggested 54
853,a9c65a5b-a3b1-4fe0-89bb-279d33949ca8_3,a-na i-ku-pí-a qí-bi-ma KÙ.BABBAR lu-ṣa-ri-ip-ma i-na a-ba-an DAM.GÀR-ri-im lu-sà-ni-iq-ma li-ik-nu-uk-ma li-dí-na-kum ù ší-bi šu-ku-šu-um ki-ma a-šu-mì ša-lim-a-šùr GÁN-lam KÙ.BABBAR e-tí-qá-ni ša-du-a-tám ú ni-is-ḫa-tim šál-ma-a-š,"To Ikūn-pīya: Let him refine the silver and check it with the weight stones of the merchant, let him seal it and give it to you. Also, set witnesses for him, confirming that the silver passes overland in Šalim-Aššur's name. Šalim-Aššur must contribute the transport tariff and the import duty.","Tokens 86-109; text ends with broken form šál-ma-a-š; interval (86,110) confirmed"
854,a9c65a5b-a3b1-4fe0-89bb-279d33949ca8_4,,"Further, Šu-Kūbum is not reliable. He must return whatever silver he has taken. He has been expelled(?) in accordance with a verdict of the City and the attorneys.","Segment 4 interval (111,110) is inverted/erroneous; no corresponding transliteration tokens found — text is broken or continuation is on a missing tablet portion"
855,aa84dc4a-b81b-4519-9d60-797b7ba276c8_0.0,KIŠIB kà-ri-im kà-ni-iš kà-ru-um dí-nam i-dí-in-ma a-na lu-qú-tim ma-la a-na a-šur-be-el-a-wa-tim i-pí-iq-du-ma ša-lim-a-šùr ú-šé-ṣí-ú ṭup-pá-am ša ku-nu-ki-šu ša-lim-a-šùr a-na šu-ku-bi-im i-da-an,"Seal of the Kanesh colony. The colony has passed a verdict: for all the goods that were entrusted to Aššur-bēl-awātim, and which Šalim-Aššur had taken out, Šalim-Aššur will give a tablet bearing his seal to Šu-Kūbum.",Interval adjusted to include i-da-an (token 20) in segment 0.0
856,aa84dc4a-b81b-4519-9d60-797b7ba276c8_1.0,a-na kur-ub-IŠTAR šu-ku-bu-um ú-lá i-tù-a-ar šu-ma a-na šu-ku-bi-im ma-ma-an i-tù-a-ar ša-lim-a-šùr ú-ba-áb-šu,Šu-Kūbum will not raise claim against Kurub-Ištar. If anyone raises claim against Šu-Kūbum Šalim-Aššur will clear him.,Interval starts after i-da-an
857,ab1021ff-2aff-4a13-86fa-6b32c4cf239e_0,a-pu-tum ri-iš lu-qú-tim ša DAM.GÀR ša-ṣí-ir,Urgent, guard the goods of the merchant;
858,ab1021ff-2aff-4a13-86fa-6b32c4cf239e_1,ú a ma-lá tí-ir-tí-kà um-ma a-ta-ma ṣú-ba-tù an-ḫu-tum i-ba-ší-ú a-pu-tum i-na ša-am-ší ṭup-pí-i ta-ša-me-ú i-na ḫu-ur-ší-im ša ib-ri-im a-ta ù i-lá-áš-ra-ni ṣú-ba-tí kà-lá-šu-nu-ma na-pí-ša-ma 3 u₄-me-e ù 5 u₄-me-e li-bi-ší-ú-ma šu-ta-áb-lá-ki-ta-šu-nu,"and with regard to your message where you said: ""There are some old textiles"" - urgent, the very day you hear my letter you and Ilī-ašrannī should air all of the textiles in the store-room of a friend, and leave them for 3 or 5 days before you turn them over.",Segment 1: tokens 6-36
859,ab1021ff-2aff-4a13-86fa-6b32c4cf239e_2,ma-ma-an ša-ni-am lá tù-ṭá-ḫa-a,Do not let anyone else approach (them).,Segment 2: tokens 37-40
860,ab1021ff-2aff-4a13-86fa-6b32c4cf239e_3,a-dí 10 u₄-me-e lá ta-ḫa-ta-ar,Do not hesitate for 10 days!,Segment 3: tokens 41-45
861,ab1021ff-2aff-4a13-86fa-6b32c4cf239e_4,a-ṣé-er e-ni-ša-ri-im a-dí AN.NA-ki-kà ú-ṣú-ur-ša-IŠTAR áš-ta-pá-ar,I have sent Uṣur-ša-Ištar to Enišārum concerning your tin.,Segment 4: tokens 46-51
862,ab1021ff-2aff-4a13-86fa-6b32c4cf239e_5,iš-tù za-al-pá i-tù-ru-nim a-lá-ḫa-am a-ṭá-ra-dam,When they come back from Zalpa I shall send Ali-aḫum.,"Segment 5: tokens 52-56; note guide has ""Ali-aḫum"" vs training ""Ali-ahum"""
863,ab1021ff-2aff-4a13-86fa-6b32c4cf239e_6,0.5 ma-na KÙ.BABBAR ṣa-ru-pá-am ú ša 3 GÍN sà-ḫi-ir-tám ku-nu-ki-a ili₅-tù-ra-am ú-šé-bi₄-lá-kum-ma 17 GÍN KÙ.BABBAR ṣa-ru-pá-am ku-nu-ki-a ší-im ṣú-ba-tí-kà id-na-a ú a-lu-wa na-áš-ú-ni-kum,I sent Ilī-tūram to you with 1/2 mina of refined silver and small goods worth 3 shekels under my seal and Idnaya and Aluwa are bringing you 17 shekels of silver under my seal the proceeds from your textiles.,Segment 6: tokens 57-79
864,ab1021ff-2aff-4a13-86fa-6b32c4cf239e_7,e-ma-ru-kà lu ak-lu,Your donkeys should be fed.,Segment 7: tokens 80-82
865,0.0,i-nu-mì i-dí-a-bu-um a-na mu-a-tim ta-ad-nu-ma É a-šùr-bé-el-a-wa-tim wa-áš-bu ša ki-ma ili₅-ba-ni ÌR ù tám-kà-ru-šu e-ru-bu-ma,When Iddin-abum was dying and was staying in Aššur-bēl-awātim's house the representatives of Ilī-bāni Wardum and his customers came in(to the house) and,Interval 0-15 correct; e-ru-bu-ma ends the introductory clause
866,1.0,um-ma ša ki-ma ili₅-ba-ni-ma ni-kà-sí iš-tí-ni ší-sí-ma,"Ilī-bāni's representatives said: ""Settle accounts with us!""-",Interval 15-22 correct; direct speech of Ilī-bāni's representatives
867,2.0,um-ma i-dí-a-bu-um-ma ṭup-pí-ku-nu kà-i-lá ù ṭup-pu-a lá-pu-tù-ma i-ba-ší-ú ša-lim-a-šur a-ḫi li-li-kam-ma iš-tí-šu ší-sí-a ù am-ma ša ki-ma i-a-tí šu-{d}EN.LÍL ù a-mur-IŠTAR i-ša-ḫa-at a-ḫi-a li-zi-zu a-dí a-ḫi-i i-lá-kà-ni ma-ma-an ṭup-pí-a lá i-pá-té,"but Iddin-abum answered: ""Hold your tablets ready for my tablets are written and available. Let my brother Šalim-Aššur come and then settle with him. Then my own representatives Šu-Illil and Amur-Ištar may assist my brother. Until my brother arrives no one may open my tablets.""",Interval 22-53 correct; Iddin-abum's full reply
868,3.0,a-na a-wa-tim a-ni-a-tim kà-ru-um kà-ni-iš i-dí-ni-a-tí-ma IGI GÍR ša a-šùr ba-áb DINGIR-lim ší-bu-tí-ni ni-dí-in,The Kanesh colony gave us for these proceedings and we gave our testimony before Aššur's dagger in the Gate of the God.,Interval 53-67 correct; legal closing formula
869,4.0,IGI a-ku-za IGI lá-qé-ep IGI ṣí-lu-lu,Witnessed by Akuza by Lā-qēp by Ṣilūlu.,Interval 67-73 correct; witness list
870,ae0714cf-a400-4cfc-973f-5d5845869bed,a-na a-lá-ḫi-im DUMU šál-ma-a-šur ù zu-ku-a KIŠIB PUZUR₄-a-šur DUMU a-šur-dan,To Ali-ahum son of Šalim-Aššur and Zukuwa; seal of Puzur-Aššur son of Aššur-dan.,Only one segment provided; full transliteration aligned to full translation. Guide 'To' corresponds to a-na at the start of the interval.
871,ae3c9a62-b6cf-4613-b686-d724bb6e0001_0,13 ma-na KÙ.BABBAR ṣa-ru-pá-am i-ṣé-er i-dí-a-bi₄-im a-mur-IŠTAR ù a-šur-i-mì-tí i-šu-ú,Iddin-abum owes 13 minas of refined silver to Amur-Ištar and Aššur-imittī.,"Segment starts at token 0; suggested interval start of 4 was too late, debt clause begins with amount"
872,ae3c9a62-b6cf-4613-b686-d724bb6e0001_1,iš-tù ḫa-mu-uš-tim ša kàr-ri-a a-na 36 ḫa-am-ša-tim i-ša-qal,Reckoned from the week of Karriya he must pay in 36 weeks.,"Segment starts at token 10 (iš-tù); suggested interval start of 14 was too late, missing the ḫamuštum clause"
873,ae3c9a62-b6cf-4613-b686-d724bb6e0001_2,šu-ma la iš-qú-ul 1.5 GÍN.TA i-na ITU.KAM-im a-na ma-na-im ú-ṣa-áb,If he has not paid (in time) he must add interest at the rate 1.5 shekel per month per mina.,Interval aligns well with suggested range; ends at ú-ṣa-áb before witness list
874,ae3c9a62-b6cf-4613-b686-d724bb6e0001_3,IGI a-šur-e-mu-qí IGI en-nam-a-šur DUMU me-na-a,Witnessed by Aššur-emūqi by Ennam-Aššur son of Menaya.,Witness list not covered by proposed segments but present in high-quality translation; added as additional segment
875,0.0,um-ma kà-ru-um kà-ni-iš-ma a-na ša-qí-il₅ da-tim ku-li-a ší-ip-ri-ni kà-ri-im dur₄-ḫu-mi-it ḫa-tù-uš ta-am-ni-a tù-ùḫ-pí-a a-dí ni-na-ša-a qí-bi₄-ma,"Thus kārum Kaniš, say to the dātu-payers, our messenger Kuliya, kārum(s) Durhumit, Hattuš, Tamnia (and) Tuhpiya, (all the way) until Nenašša:","Interval (0,16) aligns well; tokens 0–15"
876,1.0,i {d}UTU-ši ṭup-pì-ni ta-ša-me-a-ni GÍR ša a-šur šé-ṣí-a-ma ik-ri-ba-am šu-uk-na-ma ma-ma-an KÙ.AN a-na ší-mì-im a-na É.GAL-lim i-dí-nu lu a-dí-ni lá i-dí-in-ma na-ší 10-tim ša KÙ.AN ú 1 ma-na um 3 GÍN KÙ.BABBAR ša-du-a-sú ṣa-áb-ta-ma ku-li-a i pá-ni-šu li-ni-iš-a-am,"As soon as you hear our letter produce the dagger of Assur and impose an oath and whoever has sold meteoric iron to a palace or, having not yet sold it, still carries it with him, seize (from him) the tithe on the meteoric iron and his/its šaddu'utu-tax of 3 shekels silver per mina and let Kuliya personally take it along.","Interval (16,54); tokens 16–53"
877,2.0,šu-ma i-qá-bi₄ um-ma šu-ut-ma KÙ.AN ša a-wi-lim ša NÍG.KA-sí 10-tim ú ša-du-a-tám li-qé-a-ma ša ba-ri-ni li-li-kam-ma GÍR ša a-šur li-it-ma-ma ša-du-a-tám nu-ta-ar-šu-um,"If the person in question protests and declares: 'the meteoric iron belongs to \a man with an account\""","' still take the tithe and the šaddu'utu-tax and let one who is one of us come here to swear an oath by Assur's dagger then we will give him back the šaddu'utu-tax."""
878,3.0,i-da-ma IGI ku-li-a ší-ip-ri-ni GÍR ša a-šur šé-ṣí-a-ma a-ḫu-um pá-ni a-ḫi-im ú-lá ú-ba-al ma-ma-an ḫa-ra-an sú-ki-nim e-ma-re sé-er-dam ú-šé-ri-ba-ni-ma a-ma-kam uš-té-bu-lu-ni lu wa-ší-ib kà-ri-im 1 ma-na-um 3 GÍN KÙ.BABBAR ša-áš-qí-lá-šu-ma ku-li-a i pá-ni-šu li-ni-iš-a-am,"Do not fail to produce Assur's dagger in the presence of Kuliya and people shall not spare each other! Whoever has brought in loaded donkeys via the sukkinum-road in order to do business over there, even when he is a resident of the kārum, make him pay 3 shekels of silver per mina and let Kuliya personally bring it here.","Interval (76,110); tokens 76–109; segment 3 guide only mentions 'Do not fail...' but the interval covers more text including the donkey road passage up to token 109"
879,4.0,šu-ma i-qá-be um-ma šu-ut-ma,"If he protests, saying: 'I will go to clear myself in kārum Kanesh' still make him pay the silver and let him come here afterwards in order to clear accounts with us.","Interval (110,114); tokens 110–113; only the opening clause is present in the transliteration; remainder of translation corresponds to text not preserved in the given transliteration"
880,5.0,,"He shall not make trouble against (us) here, he must pay the silver (t)here!","Interval (125,114) is inverted/erroneous; no corresponding transliteration tokens found in the provided text; text appears to be incomplete or the segment is missing from the transliteration"
881,b1448360-1805-4f54-a1d4-c113cb0d7d58_0,24 ma-na KÙ.BABBAR ṣa-ru-pá-am i-ṣé-er i-dí-a-bi-im a-šùr-be-el-a-wa-tim i-šu,Iddin-abum owes 24 minas of refined silver to Aššur-bēl-awātim.,Suggested interval (4-17) adjusted; debt statement ends at i-šu (token 7)
882,b1448360-1805-4f54-a1d4-c113cb0d7d58_1,iš-tù ḫa-mu-uš-tim ša li-ba-a ù ì-lí-iš-tí-kál a-na 20 ḫa-am-ša-tim i-ša-qal,Reckoned from the week of Libbaya and Iliš-tikal he must pay within 20 weeks.,Interval end at i-ša-qal (token 17) matches suggested endpoint
883,b1448360-1805-4f54-a1d4-c113cb0d7d58_2,šu-ma la iš-qú-ul 1.5 GÍN.TA a-na ma-na-im i-na ITU.1.KAM ú-ṣa-áb,If he has not paid (in time) he must add interest at the rate 1.5 shekel per mina per month.,Suggested interval (22-45) adjusted; interest clause ends at ú-ṣa-áb (token 27)
884,b1448360-1805-4f54-a1d4-c113cb0d7d58_3,šu-ma ṭup-pu-šu i-la-pu-tù 6 ma-na KÙ.GI šu-mì a-šùr-be-el-a-wa-tim i-la-pá-at IGI a-šùr-ma-lik IGI a-lá-ḫi-im IGI a-mur-IŠTAR IGI a-gu-a,If they write his tablet he must book 6 minas of gold in the name of Aššur-bēl-awātim. Witnessed by Aššur-malik by Alāhum by Amur-Ištar by Aguwa.,Remaining tokens 28-44 covering tablet-writing clause and witness list
885,0.0,šu-bé-lúm DUMU i-dí-a-bi-im a-na PUZUR₄.IŠTAR iṣ-ba-at-ni-a-tí-ma,"Šu-Bēlum son of Iddin-abum seized us in his case against Puzur-Ištar,","Tokens 0-5; interval (0,6) is correct"
886,1.0,um-ma šu-bé-lúm-ma a-na PUZUR₄.IŠTAR-ma 16 ma-na KÙ.BABBAR ù ṣí-ba-sú a-na a-bi-a ḫa-bu-lá-tí KÙ.BABBAR ù ṣí-ba-sú im-tí-da-kum ma-na-um 0.3333 ma-na i-na ša-tim tù-ṣa-áb um-ma,"and Šu-Bēlum said to Puzur-Ištar: ""You owe 16 minas of silver plus interest to my father. The silver and the interest on it has become a great sum for you. You pay 1/3 mina per mina per year as interest.""",Tokens 6-28; interval adjusted to end at 29 (inclusive of the first um-ma of the response formula)
887,2.0,um-ma PUZUR₄.IŠTAR-ma a-bu-kà maš-ki-a il₅-qé-ma uš-ta-bu-ú,"Puzur-Ištar answered: ""Your father received my hides so he has been paid.""","Tokens 29-34; interval adjusted from (29,36) to (29,35)"
888,3.0,ki-ma šu-be-lim nu-ší-ib-ma ni-iš a-lim{ki} it-mu-ú-ma a-na 8 ma-na KÙ.BABBAR i-mì-ig-ru,We sat down (to negotiate) on behalf of Šu-Bēlum and they swore an oath by the city and agreed on 8 minas of silver.,"Tokens 35-45; interval adjusted from (36,46) to (35,46)"
889,4.0,IGI ni-mar-IŠTAR IGI en-um-a-šùr a-šùr-na-da DUMU šu-{d}EN.LÍL tap-pá-i-ni,"Witnessed by Nimar-Ištar, by Ennam-Aššur; Aššur-nādā son of Šu-Illil is our (absent) partner.","Tokens 46-53; interval (46,54) is correct"
890,5.0,a-na a-wa-tim a-ni-a-tim kà-ru-um kà-ni-iš i-dí-ni-a-tí-ma IGI GÍR ša a-šur ší-bu-tí-ni ni-dí-in,The Kanesh colony gave us for these proceedings and we gave our testimony before Aššur's dagger.,"Tokens 54-65; interval (54,66) is correct"
891,0.0,a-na i-ku-<gap> ú zu-zu-wa qí-bi-ma um-ma a-lá-bu-ma,To Iku <gap> and Zuzuwa thus Ali-abum:,Interval (0-7) correct
892,1.0,mì-nam áš-ta-na-me-ú a-mur-IŠTAR É-tí ú-da-lu-ḫu,What is this that I hear by rumour that Amur-Istar is troubling my household?,Interval (7-12) correct
893,2.0,a ṣé-er KÙ.BABBAR 10 ma-na im-ḫi-ṣí-ni,He has harmed me for an amount of 10 minas of silver!,Interval (12-18) correct
894,3.0,a-ma-kam a-mur-IŠTAR i-na É-be-tim ṭù-ur-da,Over there chase Amur-Istar out of the house.,Interval (18-23) correct
895,4.0,<gap>-bi-i <gap> iš-tí i-na-a-a ṭá-ḫi-a-šu-ma a-na kà-ri-im li-im-šu-ur-šu,<gap> confront him with Innaya so that the latter can coax him along to the karum.,Interval adjusted to (23-31) to include full clause
896,5.0,a-ḫu-ú-a-tù-nu a ṣé-er ṣú-ḫa-ar-tim ú É-be-tim e-ku-nu li-li-ik,Please my brothers keep an eye on the girl and on the house.,Interval adjusted to (31-39)
897,6.0,am-tum i-ḫa-li-iq,The maid might perish!,Interval was inverted (43-41); corrected to (39-41)
898,b56177e7-367e-44cc-af40-a8ef9295b2b3_0.0,ša ḫu-bu-ul i-ri-ší-im <gap> ma-na KÙ.BABBAR ṣa-ru-pá-am i-ṣé-er i-ri-ší-im tám-kà-ru-um i-šu,Concerning Irišum's debt: Irišum owes <gap> minas of refined silver to the merchant.,Interval adjusted slightly leftward from position 15 to position 12 to include ša ḫu-bu-ul i-ri-ší-im which corresponds to the debt clause in the guide translation.
899,0.0,10 ma-na KÙ.BABBAR ṣa-ru-pá-am tù-ur-a-a DUMU ú-zu-a i-na ší-im SÍG.ḪI.A ša ú-ší-na-lam il₅-qé,Tūraya son of Uzuwa has received 10 minas of refined silver from the proceeds of Ušinalam's wool.,Interval adjusted to include il₅-qé (token 13) in segment 0.0; break placed after token 13
900,1.0,IGI a-šùr-i-mì-tí DUMU du-dí-ki IGI en-na-sú-in IGI a-šùr-e-mu-qí DUMU i-ku-nim IGI a-šùr-DU₁₀ DUMU en-na-sú-in DUMU za-li-dí,Witnessed by Aššur-imittī son of Dudiki by Enna-Suen by Aššur-emūqī son of Ikūnum by Aššur-ṭāb son of Enna-Suen (grand)son of Zalidī.,Witness list from token 14 to 29; interval start corrected from 13 to 14
901,0.0,IGI be-lúm-ba-ni DUMU a-šur-be-el-a-wa-tim IGI SIG₅-pì-a-šur DUMU wa-ar-dí-li-šu IGI lá-qé-pí-im DUMU PUZUR₄.SÁ.TU,Witnessed by Bēlum-bāni son of Aššur-bēl-awātim, by Damiq-pī-Aššur son of Warad-ilīšu
902,b82af2f6-f439-4d3d-93bb-6883f8f65685_0.0,8 ma-na KÙ.BABBAR ṣa-ru-pá-am da-dí-a DUMU en-na-nim i-na ší-im SÍG.ḪI.A ša ú-ší-na-lam il₅-qé,Dādiya son of Ennānum has received 8 minas of refined silver from the proceeds of Ušinalam's wool.,Interval (1-13) is correct; il₅-qé closes the main clause naturally.
903,b82af2f6-f439-4d3d-93bb-6883f8f65685_1.0,IGI a-šùr-i-mì-tí DUMU du-dí-ki IGI tù-ur-a-a DUMU ú-zu-a IGI en-na-sú-in DUMU i-dí-a-bi-im,Witnessed by Aššur-imittī son of Dudiki by Tūraya son of Uzuwa by Enna-Suen son of Iddin-abum.,Interval (14-25) is correct; witness list begins with IGI and covers all three witnesses.
904,0.0,a-na a-lá-ḫi-im qí-bi-ma um-ma SIG₅-pí-i-a-šur-ma ù MAN-a-šur,To Ali-ahum from Damiq-pī-Aššur and also Puzur-Aššur:,Interval adjusted to end at token 6 (before i-na); suggested interval (0-7) is correct
905,1.0,i-na ḫa-ḫi-im ú-nu-ut-ni nu-ša-li-ḫa-ku-ni,In Hahhum we set aside our goods for you.,Interval (7-11) correct; tokens 7-10
906,2.0,i-na za-al-pá ù a-na-kam ni-iš-ta-na-me-ma ḫa-ra-an sú-ki-nim dan-na-at,In Zalpa and here we keep hearing that the Narrow Track is difficult.,Interval (11-19) correct; tokens 11-18
907,3.0,lá na-ṭù-ma lá né-ra-áb,It is not a good idea for us to enter.,Interval (19-23) correct; tokens 19-22
908,4.0,a-ḫu-ni a-ta ki-ma AN.NA 10 ma-na <gap> ù 10 TÚG,Our dear brother advise us whether we should dispatch to there (where you are) some 10 minas of tin and 10 textiles that we bring.,Interval (23-33) correct; tokens 23-32; remainder of translation not covered by transliteration due to gap/missing tokens
