,oare_id,aligned_transliteration,aligned_translation,comment
0,004a7dbd-57ce-46f8-9691-409be61c676e_0,KIŠIB ma-nu-ba-lúm-a-šur DUMU ṣí-lá-{d}IM KIŠIB šu-{d}EN.LÍL DUMU ma-nu-ki-a-šur KIŠIB MAN-a-šur DUMU a-ta-a,Seal of Mannum-balum-Aššur son of Ṣilli-Adad, seal of Šu-Illil son of Mannum-kī-Aššur
1,004a7dbd-57ce-46f8-9691-409be61c676e_1,0.3333 ma-na 2 GÍN KÙ.BABBAR SIG₅ i-ṣé-er PUZUR₄-a-šur DUMU a-ta-a a-lá-ḫu-um i-šu,Puzur-Aššur son of Ataya owes 22 shekels of good silver to Ali-ahum.,Suggested interval (13-24) adjusted to (12-24); includes the silver amount with the debt statement.
2,004a7dbd-57ce-46f8-9691-409be61c676e_2,iš-tù ḫa-muš-tim ša ì-lí-dan ITU.KAM ša ke-na-tim li-mu-um e-na-sú-in a-na ITU 14 ḫa-am-ša-tim i-ša-qal,Reckoned from the week of Ilī-dan, month of Ša-kēnātim
3,004a7dbd-57ce-46f8-9691-409be61c676e_3,šu-ma lá iš-qú-ul 1.5 GÍN.TA a-na 1 ma-na-im i-na ITU.1.KAM ṣí-ib-tám ú-ṣa-áb,If he has not paid in time, he will add interest at the rate 1.5 shekel per mina per month.
4,009fb838-8038-42bc-ad34-5f795b3840ee_0.0,KIŠIB šu-{d}EN.LÍL DUMU šu-ku-bi-im KIŠIB ṣí-lu-lu DUMU ú-ku,Seal of Šu-Illil son of Šu-Kūbum, seal of Ṣilūlu son of Uku.
5,009fb838-8038-42bc-ad34-5f795b3840ee_1.0,i-nu-mì i-dí-a-bu-um a-wa-sú iq-bi-ú 10 ma-na KÙ.BABBAR a-na ša-lim-a-šùr i-dí-in,When Iddin-abum spoke his will, he gave 10 minas of silver to Šalim-Aššur.
6,009fb838-8038-42bc-ad34-5f795b3840ee_2.0,um-ma šu-ut-ma i-ṣí-ba-at KÙ-pì-a li-il₅-qé,"He said: ""He may take it from the interest on my silver.""",Interval (18-23) correct; quoted speech introduced by umma
7,0.0,a-na É šál-ma-a-šùr a-na a-wa-tim né-ru-ub-ma,We entered Šalim-Aššur's house to settle the case,Interval (0-6) is correct
8,1.0,um-ma šál-ma-a-šùr-ma i-a-tí a-na bu-ru-uš-ḫa-dim i-na ma-ak-sú-e-im a-na ḫu-bu-ul ÌR a-bu-ša-lim ša-qá-lim i-ra-de₈-ú-ni a-ta 30 TÚG ku-ta-ni ù ANŠE ṣa-lá-ma-am ša ÌR ta-lá-qé-e,"and Šalim-Aššur said: ""While they are going to lead me personally to Burušhaddum in fetters to pay the debt of the slave Abu-šalim, will you on the other hand take 30 kutānu-textiles and a black donkey from the slave?""",Interval adjusted to (6-29) to include ta-lá-qé-e
9,2.0,um-ma šu-be-lúm-ma ke-na ša ÌR-dí-a a-bu-ša-lim al-qé ša-lim-a-šur ša ni-iš a-lim{ki} úz-na-tí-ni il₅-pu-ut,"Šu-Bēlum answered: ""Yes, I have taken what belongs to my slave Abu-šalim."" Šalim-Aššur impressed on us what had been sworn by the City,",Interval adjusted to (29-42) to start after ta-lá-qé-e
10,3.0,um-ma ša-lim-a-šur-ma a-šar ÌR a-na ÌR-dí-kà lá i-tù-ru-ú ma-a a-na ÌR-dí-a i-tù-wa-ar,"and Šalim-Aššur said: ""In case the slave does not raise claim against your slave, then, will he raise claims against my slave?""",Interval adjusted to (42-54) to include i-tù-wa-ar
11,4.0,um-ma šu-be-lúm-ma šu-ma a-na ku-a-im i-tù-a-ar a-na TÚG.ḪI.A ù ANŠE.ḪI.A a-za-za-kum,"Šu-Bēlum answered: ""If he raises claim against yours, then I guarantee for the textiles and the donkey for you.""",Interval adjusted to (54-65) to start after i-tù-wa-ar
12,5.0,a-na a-wa-tim a-ni-a-tim kà-ru-um kà-ni-iš i-dí-ni-a-tí-ma IGI GÍR ša a-šùr ší-bu-tí-ni ni-dí-in,The Kanesh colony gave us for these proceedings and we gave our testimony before Aššur's dagger.,Interval adjusted to (65-77) to include ni-dí-in
13,6.0,IGI ú-ra-a IGI ì-lí-dan IGI ma-ni-um-ba-lúm-a-šùr,"Witnessed by Uraya, by Ilī-dan, by Mannum-balum-Aššur.",Interval adjusted to (77-83)
14,01cc1406-fc42-4252-aeae-6b4538b069c5_0,17 GÍN KÙ.BABBAR ší-im e-ma-ri-im 30 ma-na URUDU IŠTAR-pí-lá-aḫ a-na ar-be-e-šu <gap> ù-kà-pu-ú ša-pì-ú-tim 9 ma-na URUDU SIG₅ i ší-im sú-ub-ri-im 1 ma-na URUDU ší-kam iš-tí DUMU IŠTAR-ba-ni 2 kà-ar-pát kà-mu-nu mì-ma a-nim i-na du-ur-ḫu-mì-it i-ba-ší,17 shekels of silver, the price of a donkey
15,01cc1406-fc42-4252-aeae-6b4538b069c5_1,10 pí-ri-kà-nu 1 GÚ SÍG.ḪI.A 2 ú-kà-pé-e 80 lu-ur-ma-tum 10 ma-na Ì.GIŠ sà-ar-dam sà-áp-tí-nam ni-ib-ra-ra-am 2 ší-it-re-e ša za-al-pá 2 e-ma-re ú ù-nu-sú-nu mì-ma a-nim a-na a-šùr-i-mì-tí a-dí-in,10 pirikannu-textiles, 1 talent of wool
16,020aa8bd-69a4-43a9-8120-efd9e587bb1c_0.0,IGI GÍR ša a-šu,"Witnesses: Aššur-idī, Elāli; Puzur-ilī son of Balzuenum was our (absent) partner.",The transliteration appears incomplete/truncated at this point; the witness names (Aššur-idī
17,02f0ecc7-746b-449d-803c-c05ebbda2336_0.0,kà-ru-um dí-nam i-dí-in-ma ša-lim-a-šùr ṭup-pu-šu a ší-bi-šu ma-lá KÙ.BABBAR a-na ḫu-bu-ul i-dí-a-bi-im ú-ša-qí-lu ŠU.NÍGIN KÙ.BABBAR a-na me-er-e i-dí-a-bi-im i-qá-bi um-ma šu-ut-ma KÙ.BABBAR a-nim a-ḫa-a ú-ša-qí-il₅,The colony has passed a verdict stating that Šalim-Aššur must mention to the sons of Iddin-abum his tablets for his witnesses to how much silver - all the silver - he has paid to cover Iddin-abum's debt. He is to say: This silver I paid in different places.,Single segment covering entire text; interval (0-25) spans full transliteration.
18,0.0,13 ma-na KÙ.BABBAR ṣa-ru-pá-am en-um-a-šùr DUMU sú-in-na-da 5.3333 ma-na KÙ.BABBAR ṣa-ru-pá-am sú-in-na-da me-ra-šu il₅-qé-ú i-na ší-im <gap>,"Ennam-Aššur son of Suen-nādā has received 13 minas of refined silver, and Suen-nādā his son has received 5.3333 minas of refined silver .",Segment covers the main transaction; guide translation mentions proceeds of wool but the high-quality translation omits this detail; break placed after <gap> before witness list
19,1.0,IGI a-šùr-i-mì-tí IGI iš-me-DINGIR IGI bi-<gap> DUMU ḫa-na-ni-a IGI DINGIR.SIPA DUMU ša-ak-ṣí-im,"Witnessed by Aššur-imittī, by Išme-ilum, by Bi<gap> son of hannāniya, by Ilī-rē'ī son of Šakṣum.",Witness list segment aligned straightforwardly
20,0.0,4 GÍN KÙ.BABBAR i-ṣé-er <gap>-a-šur DAM.GÀR i-šu,4 shekels of silver <gap>-Aššur owes to the creditor.,Interval adjusted to include i-šu as part of the debt clause
21,1.0,ITU.KAM a-lá-na-tim a-na ITU.KAM i-ša-qal,Contracted in month XII. He will pay within a month.,Starts at token 8; interval start shifted by 1
22,2.0,šu-ma lá iš-qúl 0.3333 GÍN.TA i-na ITU.KAM ú-ṣa-áb,If he does not pay he will add as interest 0.3333 shekel per month,Interval as suggested
23,3.0,li-mu-um a-šùr-na-da,Year eponymy of Aššur-nādā,Interval as suggested
24,4.0,ḫa-mu-uš-tum ša qá-té kà-ar-wa-a,week eponymy of the successor of Karwaya,Interval as suggested
25,5.0,IGI a-šur-i-dí,Witnessed by Aššur-idī,Interval as suggested
26,041c9029-8f6f-40f8-989b-77a75878221c_0.0,a-na a-lá-ḫi-im qí-bi₄-ma um-ma PUZUR₄-a-šur-ma,To Ali-ahum from Puzur-Aššur:,Standard Old Assyrian epistolary opening formula; interval correctly captures the address and sender introduction
27,0480d321-8019-4775-bb29-5ac41b659c02_0,a-na ku-li-a qí-bi-ma um-ma a-sá-num-ma,To Kuliya say thus says Asānum:,Interval 0-5 correct
28,0480d321-8019-4775-bb29-5ac41b659c02_1,a-šu-mì a-ší-im sá-aḫ-ra-a-ku a-ši-a-im,I am still staying (here) because of the meteoric iron.,"Interval 5-9 adjusted; a-ši-a-im belongs here as ""I will sell it"" fits next segment better; keeping 5-9"
29,0480d321-8019-4775-bb29-5ac41b659c02_2,i-ma-gu₅-ru a-da-šu-ma a-ta-be-a-am-ma a-ta-lá-kam,When they agree with the (quality/price of the) iron I will sell it get ready and leave for you.,Interval 9-13 correct
30,0480d321-8019-4775-bb29-5ac41b659c02_3,a-dí-i na-áš-pè-er-tí-kà ša a-šu-mì kà-lá-pí-im i-li-kà-ni ší-bé-e a-dí-ni lá aḫ-ri-im,As for your letter which arrived here concerning the axe I have not yet recorded (the depositions) of the witnesses.,Interval 13-23 adjusted from 13-20; segment ends before witness names
31,0480d321-8019-4775-bb29-5ac41b659c02_4,i ší-be-a a-zu kà-ṣa-ar PUZUR₄-a-mur,Among my witnesses figures Azu the transporter of Puzur-Aššur.,Interval 23-28 adjusted
32,0480d321-8019-4775-bb29-5ac41b659c02_5,be-li a-ta a-na a-na PUZUR₄-a-mur pu-nu-ma a-zu-ú li-iṭ-ru-dam iš-tí tap-pá-i-šu ší-bu-tám li-dí-nam,Please my lord approach Puzur-Aššur and let him send Azu to me so that he can testify for me together with his colleagues.,Interval 28-40 correct
33,0480d321-8019-4775-bb29-5ac41b659c02_6,i-na lá i-da-i-a a-mì-ša-am i-tal-kam um-ma šu-ut-ma a-na e-lá-lí a-lá-ak,Without my knowledge he has left for there saying: I am going to Elālī.,Interval 40-49 adjusted to end of text
34,0.0,a-na a-ta-ta ù kà-nu-tim qí-bi₄-ma um-ma a-na-aḫ-ì-lí-ma,Say to Atata and Kannūtum thus Anah-ilī:,Segment covers the address formula words 0-6
35,1.0,0.5 ma-na KÙ.KI ù 1.5 ma-na KÙ.BABBAR ša kà-nu-tim ša il₅-ba-ni ki-ma kà-nu-tim KÙ.BABBAR ip-qí-da-ni a-na-kam a-lá-bu-um ú-ni-ḫi-ma KÙ.BABBAR 1 ma-na ú-ša-ag-me-er,"(As for the) 1/2 mina of gold and 1 1/2 mina of silver, belonging to Kannūtum, which silver Ilī-bāni, representing Kannūtum, entrusted to me - here Ali-abum has troubled me and caused expenses of 1 mina of silver.",Words 7-28; interval adjusted to end at ú-ša-ag-me-er
36,2.0,a-na a-lim{ki} im-ta-ša-ra-ni-ma i-na dí-in a-lim{ki} KÙ.BABBAR ú KÙ.KI a-lá-bu-um i-lá-qé-ma a-na a-wa-at kà-nu-tim lá-bu-um i-za-az,He has now dragged me before the City and by verdict of the City Ali-abum will take that silver and gold and Ali-abum will be responsible for Kannūtum's interests.,Words 29-44
37,3.0,šu-ma kà-nu-tum a-na a-na-aḫ-ì-lí ta-tù-wa-ar a-lá-bu-um ú-ša-ḫa-sú-ú,Should Kannūtum come back on Anah-ilī then Ali-abum will clear him.,Words 45-51
38,4.0,KÙ.BABBAR ú KÙ.KI šu-ut a-na É a-lim{ki} a-na ḫu-bu-ul ili₅-ba-ni i-ší-qí-il₅,"The afore-mentioned silver and gold have been paid to the ""City House"" for (to cover) Ilī-bāni's debts.",Words 52-62
39,5.0,a-ma-kam a-le té-er-tí ili₅-ba-ni i-ba-ší-ú ša 0.5 ma-na KÙ.KI pá-ša-lamₓ ù 1.5 ma-na KÙ.BABBAR ú ší-a-ma-tí-šu ṣa-áb-ta-ma mì-ṣí-a-ma li-qí-a,"Over there, wherever goods ordered by Ilī-bāni are available, seize for a value of 1/2 mina of pašallum gold and 1 1/2 mina of silver or what has been bought for it and take it at your own responsibility.",Words 63-81
40,6.0,ṭup-pá-am ša a-lim{ki} da-nam ša ki-ma KÙ.KI ú KÙ.BABBAR ša kà-nu-tí-ni ú-kà-al,I have a strong tablet of the City stating that the silver and gold belong to Kannūtum.,Words 82-93
41,7.0,ú šu-ma ku-li-a i-lá-kam-ma a-wa-tim ú-ga-mar a-dí a-lá-kà-ni i-ta-ba-lá-šu a-wa-tim lá tù-ga-ma-ra,"And if Kuliya comes in order to settle the affair, hold him in play until I arrive, do not settle the affair!",Words 94-105
42,06ec260a-bcc5-4762-b2ee-dfbc10cfbfbe,ṭup-pu-ú ḫa-ru-mu-tum ša ší-bi-a ša me-er-e i-dí-a-bi₄-im,Certified tablets with my witnesses concerning the sons of Iddin-abum.,Interval (0-7) covers the entire transliteration; single segment alignment is correct and complete.
43,091abe17-bf55-4912-b402-15442365622a_0.0,a-na a-lá-ḫi-im ú zu-ku-a qí-bi-ma um-ma PUZUR₄-a-šur-ma,To Ali-ahum and Zukuwa from Puzur-Aššur:,Standard epistolary opening formula; interval matches well
44,099eb63c-4a3c-4bca-baf4-705a46083a49_0,1.5 ma-na KÙ.BABBAR iš-ra-tim pu-šu-ki-in DUMU bu-za-zu i-na ku-bu-ur-na-at nu-ša-dí-in-ma ŠÀ.BA 1 ma-na KÙ.BABBAR šu-sú-in DUMU áb-lá-ma-sí ú a-šùr-i-dí DUMU a-da-da ku-nu-ki ša wa-bar-tim ú ku-nu-ki-a a-na kà-ri-im i-ni-iš-ú,"1.5 mina of silver, the tithe, we collected from Pusu-ken, son of Buzazu, in Kuburnat, and 1 mina of silver thereof Su-Suen, son of Abi-lamassi, and Assur-idi, son of Adada, are bringing to the karum under the seal of the wabartum and my seal.",Segment 0 - covers tokens 1-27 as per suggested interval
45,099eb63c-4a3c-4bca-baf4-705a46083a49_1,0.5 ma-na KÙ.BABBAR i-na tù-ùḫ-pí-a a-šùr-ma-lik DUMU ku-ra-ra e-pu-ul a-na kà-ri-im i-ša-qal,"For 0.5 mina of silver Assur-malik, Kurara's son, gave his promise in Tuhpiya, he will pay to the karum.",Segment 1 - covers tokens 28-41
46,099eb63c-4a3c-4bca-baf4-705a46083a49_2,15 GÍN KÙ.BABBAR DUMU a-lu-lá-a i-na ḫa-na-ak-na-ak nu-ša-dí-ma ku-nu-ki-ni li-ba-a ù ku-bi-a i-ni-iš-ú,15 shekels of silver we collected from Alulaya's son in Hanaknak and under our seals Libaya and Kubiya are bringing it.,Segment 2 - covers tokens 42-54
47,099eb63c-4a3c-4bca-baf4-705a46083a49_3,0.3333 ma-na KÙ.BABBAR ša-du-a-tám ni-mar-sú-in DUMU da-dí-a i-na du-ur-ḫu-mì-it nu-ša-dí,"0.3333 mana of silver, saddu'utu-tax, we levied from Nimar-Suen, son of Dadiya, in Durhumit.",Segment 3 - covers tokens 55-64
48,099eb63c-4a3c-4bca-baf4-705a46083a49_4,1.5 GÍN KÙ.AN iš-ra-tim šu-ma-bi₄-a DUMU a-šùr-e-li-tí nu-ša-dí-ma ku-nu-ke-e ša kà-ri-im du-ur-ḫu-mì-it i-na ší-na-ḫu-tim IGI wa-bar-tim a-na šu-a-nim DUMU me-na-nim ù ma-num-ki-{d}IŠKUR áp-qí-id-ma a-na kà-ri-im i-ni-iš-ú,"1.5 shekels of meteoric iron, the tithe, we levied from Sumi-abia, son of Assur-elliti, and under the seals of karum Durhumit I entrusted it in Sinahuttum before the wabartum to Su-Anum, son of Menanum, and Mannum-ki-Adad, who are bringing it to the karum.",Segment 4 - covers tokens 65-90
49,099eb63c-4a3c-4bca-baf4-705a46083a49_5,10 GÍN KÙ.BABBAR ša-du-a-tám bu-ṣí-a ša ku-bu-ur-na-at i-na tù-ùḫ-pí-a nu-ša-dí-ma ku-nu-ki-ni {d}EN.LÍL-ba-ni DUB.SAR a-na kà-ri-im i-ni-ší-i,"10 shekels of silver, saddu'utu-tax, we levied from Busia of Kuburnat in Tuhpiya and under our seals Enlil-bani, the scribe, is bringing it to the karum.",Segment 5 - covers tokens 91-106
50,099eb63c-4a3c-4bca-baf4-705a46083a49_6,0.5 ma-na KÙ.BABBAR ša-du-a-tám ṣú-,"Half a mina of silver, saddu'utu-tax, [we levied from] the servants of [Mannum-b]alum-Assur, son of Kukua.",Segment 6 - text breaks off with ṣú- indicating continuation into damaged/missing portion
51,0.0,a-na ku-li-a qí-bi₄-ma um-ma a-ba-ba-a-ma,To Kuliya thus says Ababaya:,Interval (0-5) correct
52,1.0,šál-ma-ni ṣú-ḫu-ur-kà ša-lim ni-šu-kà šál-mu,"We are well, your youngsters are well, and your people are well.",Interval (5-10) correct
53,2.0,ki-ma ku-a-tí i-<gap> a-bi₄-kà a-<gap> a-wa-tí-kà <gap> i-ṣé-ri-a <gap>,Like/Instead of your .... of your father ..... your words .... on me (?).....,Interval corrected to (10-19); suggested end of 20 was slightly off
54,3.0,ma-num <gap> li-dí-nam <gap>,Who could give me ..... ........,Interval corrected to (19-23); suggested (20-28) was off
55,4.0,ša ta-<gap> té-tap-ša-ni <gap> na,By what you .... you have treated me .... ....,Interval corrected to (23-28); segment boundary adjusted
56,5.0,<gap> lá i-<gap> e tù-kà-<gap> iš-tù na-áš-pè-er-ta-kà lá ta-lá-kà-ni,... do not .... since no letter of yours arrives here.,Interval corrected to (28-37); suggested (41-61) was significantly off
57,6.0,mì-nam ša ta-áš-ta-na-pá-ra-ni um-ma a-ta-ma ṣú-ba-tí ḫa-am-ša-at šé-bi₄-li-im,What is the purpose of constantly writing me as follows: Send me five textiles!,Interval corrected to (37-45); suggested (61-69) was off
58,7.0,mì-nam ṣú-ḫa-ar-kà li-ku-ul mì-nam a-ṣí-tí-kà lá-áš-qú-ul šu-ma a-na a-bi₄-kà lá uš-té-ri-id,"What should your boy eat, what should I (use to) pay for your expenditures if I had not humbled myself for your father.",Interval corrected to (45-56); suggested (69-80) was off
59,8.0,um-ma šu-ut-ma ú-ḫa-lá-qú-nu GA ša-ni-a-tù i pì-šu ša-ak-na,He said: He is destroying you .... he has evil intentions!,Interval corrected to (56-64); suggested (80-88) was off
60,9.0,me-er-a-at-kà iš-tí-a ta-al-ta-<gap> um wa-áš-ba-at <gap> ša É a-bi₄-ni tim,Your daughter is/keeps .... with me she lives .... of our paternal house .... [.......,Interval corrected to (64-74); suggested (88-95) was off
61,10.0,<gap> áb e ta-ḫi-ri-<gap> ta-áp-ḫi-ra-am a-dí-in-ma,I have sold the savings and slaughtered the ox.,Interval corrected to (74-80); suggested (108-95) was erroneous
62,11.0,GU₄ aṭ-bu-ùḫ ší-ru-um ša i-ri-u ša-áp-lá-nu-um i-tab-ku,The meat which remained they have stored below.,Interval corrected to (80-87); suggested (112-95) was erroneous
63,12.0,4 GÚ URUDU ag-mur <gap>-KAM ṣú-ùḫ-ur-kà lá i-mu-ut,I have spent 4 talents of copper (for) your youngsters must not die!,Interval corrected to (87-95); suggested (118-95) was erroneous
64,0.0,17 ma-na KÙ.BABBAR ṣa-ru-pá-am ù 7.5 GÍN KÙ.GI pá-ša-lam a-šùr-i-mì-tí DUMU e-ta-a i-na ší-im SÍG.ḪI.A ša ú-ší-na-lam il₅-qé,Aššur-imittī son of Etaya has received 17 minas of refined silver and 7.5 shekels of -gold from the proceeds of Ušinalam's wool.,Break after il₅-qé which closes the main transaction clause; interval suggestion of 18 is accurate.
65,1.0,IGI e-nu-um-we-er DUMU šu-da-a IGI i-lá-áš-ra-ni DUMU sú-kà-li-a IGI en-na-sú-in DUMU i-dí-a-bi-im IGI DUMU a-bu-bu ta-ar-dí-im,Witnessed by Ennam-Wēr son of Šudaya, by Il-ašrannī son of Sukalliya
66,0e330375-456e-4955-a1a5-083183efa458,5 ma-na KÙ.BABBAR KI a-šur-ta-ak-lá-ku,5 minas of silver is owed by Aššur-taklāku.,Interval adjusted to cover words 1-5 matching the guide translation; suggested interval (2-25) appears too broad for this segment.
67,0.0,um-ma kà-ru-um kà-ni-iš-ma a-na ša-qí-il₅ da-tim ku-li-a ší-ip-ri-ni wa-bar-tim ša ku-bur-na-at ḫa-na-ak-na-ak ú tí-iš-mur-na TUR GAL qí-bi₄-ma,Thus kārum Kanish say to the dātu-payers our messenger Kuliya the plenary wabartums of Kuburnat Hanaknak and Tišmurna:,Tokens 0–16; suggested interval (0-17) correct
68,1.0,i {d}UTU-ši ṭup-pì-ni ta-ša-me-a-ni GÍR ša a-šur IGI ku-li-a ší-ip-ri-ni šé-ṣí-a-ma ma-ma-an a-ma-kam KÙ.AN na-áš-ú lu a-na ší-mì-im a-na É.GAL-lim i-dí-nu lu a-dí-ni lá i-dí-in-ma na-ší 10-tim ša KÙ.AN ú ša-du-a-sú 1 ma-na-um 3 GÍN KÙ.BABBAR ša-ás-qí-lá-ma,As soon as you hear our letter produce the dagger of Assur out in the presence of our messenger Kuliya and whoever over there carries meteoric iron whether he has already sold it to a palace or has not yet sold it and still carries it make him pay the tithe on the meteoric iron and his šaddu'utu-tax of 3 shekels of silver per mina.,Tokens 17–53; suggested interval (17-54) correct
69,2.0,ku-li-a i pá-ni-šu-nu lu-ub-lam,Let Kuliya personally(!) bring it here.,Tokens 54–57; suggested interval (54-58) correct
70,3.0,šu-ma i-qá-bi₄ um-ma šu-ut-ma KÙ.AN ša a-wi-lim ša NÍG.KA-sí 10-tim ú ša-du-a-sú le-qé-a-ma ša ba-ri-ni li-li-kam-ma GÍR ša a-šur li-it-ma-ma ša-du-a-sú nu-ta-ar,"If one protests and declares: ""The meteoric iron belongs to a man with an account!"" take the tithe and his šaddu'utu-tax and let somebody who is one of us come here to swear an oath by Aššur's dagger then we will give his šaddu'utu-tax back.",Tokens 58–79; suggested interval (58-80) correct
71,4.0,ni-ša-me-ma 30 ANŠE tù-i-mu-um DUMU a-šùr{ki} ḫa-ra-an sú-qí-nim ú-šé-ri-ba-am,We hear that an Assyrian Tu'imum has brought in 30 donkeys by way of the sunkinnu-road.,Tokens 80–88; suggested interval (80-89) correct
72,5.0,lá tù-i-mu-um ma-ma-an ḫa-ra-an sú-ki-nim e-ma-re sé-er-dam ú-šé-ri-ba-ni-ma a-ma-kam uš-té-bu-lu-ni lu wa-ší-ib kà-ri-im ú-šé-li-am GÍR ša a-šur šé-ṣí-a-ma a-ḫu-um pá-ni a-ḫi-im ú-lá ú-ba-al,Not just Tu'imum but anybody who has brought in a loaded donkey by way of the sukinnu-road in order to do business there or if an inhabitant of a kārum has brought up (goods) - produce the dagger of Assur and people shall not spare each other!,Tokens 89–111; suggested interval (89-117) adjusted to 89-111
73,6.0,1 ma-na um 3 GÍN KÙ.BABBAR ša,Charge everybody his šaddu'utu-tax at a rate of three shekels of silver per mina.,Tokens 112–118; text breaks off mid-sentence with ša indicating tablet continues; segments 7-10 correspond to text beyond preserved portion
74,7.0,[text not preserved in transliteration],And make them pay; Kuliya personally bring it here.,Text continues beyond preserved transliteration; interval markers (121-119) indicate continuation
75,8.0,[text not preserved in transliteration],"If somebody protests saying: ""I will go to clear myself in kārum Kanesh"" (still) make him pay the silver and let him come here afterwards in order to clear accounts with us.",Text continues beyond preserved transliteration; interval markers (126-119) indicate continuation
76,9.0,[text not preserved in transliteration],Take care that our messenger Kuliya is not delayed.,Text continues beyond preserved transliteration; interval markers (141-119) indicate continuation
77,10.0,[text not preserved in transliteration],Make people pay the silver don't allow them to make trouble there!,Text continues beyond preserved transliteration; interval markers (146-119) indicate continuation
78,1252b18d-4b89-4af9-b6b9-199b40c13848_0.0,a-na a-lá-ḫi-im qí-bi-ma um-ma SIG₅-pí-i-a-šur-ma,To Ali-ahum from Damiq-pī-Aššur:,Standard Old Assyrian epistolary opening formula; SIG₅-pí-i-a-šur = Damiq-pī-Aššur
79,132bb95c-07f6-4ef2-a8ff-ee8a54fbc1d5_0.0,a-na a-dí-da a-lá-ḫi-im ú a-ba-a a-na a-ba-a qí-bi-ma um-ma SIG₅-pì-a-šur-ma <gap>,"To Adida, Al-aḫum and Abaya; specifically to Abaya from Damiq-pī-Aššur",Standard Old Assyrian letter opening formula; SIG₅-pì-a-šur = Damiq-pī-Aššur; gap follows sender identification
80,14b6f3ac-433a-4c1e-a029-cbb28750364b_0.0,a-na a-lá-ḫi-im qí-bi-ma um-ma MAN-a-šur-ma,To Ali-ahum from Puzur-Aššur:,Standard Old Assyrian epistolary opening formula; MAN-a-šur = Puzur-Aššur
81,154bfa3c-bd94-439c-b139-06e6d0a027af_0,ma-na 2 GÍN KÙ.BABBAR i-ṣé-er me-a-ri a-lá-ḫu-um i-šu,Meari owes 1 mina 2 shekels of silver to Ali-ahum.,Interval adjusted to include i-šu (token 7); break after token 7
82,154bfa3c-bd94-439c-b139-06e6d0a027af_1,iš-tù ḫa-mu-uš-tim ša a-šur-i-mì-tí ITU.KAM ša ke-na-tim li-mu-um ša qá-tí a-šur-i-mì-tí 2 GÍN.TA i-na ITU.KAM-im ṣí-ib-tám ú-ṣa-áb,Reckoned from the week of Aššur-imittī, month Ša-kēnātim
83,154bfa3c-bd94-439c-b139-06e6d0a027af_2,IGI šu-pu-na-aḫ-šu IGI a-na-lí ú-mì-šu,Witnessed by Šuppun-ahšu, by Annali his mother.
84,0.0,20 ma-na URUDU ma-sí-am i-ṣé-er i-dí-a-bi-im ma-ma-ḫi-ir i-šu ITU.KAM li-mu-um bu-zu-ta-a a-na ša-na-at i-ša-qal,"Iddin-abum owes 20 minas of washed copper to Man-mahir. Month Kuzallu, eponym of Buzutaya. He must pay in one year.",Suggested interval start (6) was misplaced; segment correctly begins at token 0. Break after i-ša-qal (token 13) is accurate.
85,1.0,šu-ma lá iš-qúl 1 ma-na.TA i-na ITU.KAM ṣí-ib-tám a-na 10 ma-na-e ú-ṣa-áb IGI ṣí-lu-uš-da-gan IGI a-šùr-ba-ni,"If he has not paid in time, he must pay interest at the rate 1 mina per ten minas per month. Witnessed by Ṣilluš-Dagān, by Aššur-bāni.",Interval start at token 14 (šu-ma) is correct. Guide translation note: interest rate is 1 mina per 10 minas (not 10 per mina); high-quality translation is followed.
86,168d7873-608c-4ba9-9087-5f4945fdc7d7_0.0,a-na en-na-sú-in ú a-lá-ḫi-im qí-bi₄-ma um-ma PUZUR₄-a-šur-ma,To Enna-Suen and Ali-ahum from Puzur-Aššur:,Standard Old Assyrian epistolary opening formula; guide translation renders a-lá-ḫi-im as Al-aḫum while full translation uses Ali-ahum; interval (0-77) correctly captures this opening segment
87,0.0,a-na ì-lí-ba-ni ù ku-li-a a-na ì-lí-ba-ni qí-bi-ma um-ma a-šùr-e-nam-ma,To Ilī-bāni and Kuliya, to Ilī-bāni in particular say
88,1.0,0.8333 ma-na KÙ.BABBAR i-na ša-lá-tí-wa-ar ku-li-a ku-nu-ki-šu i-dí-nam,In Šaladiwar Kuliya gave me 5/6 mina of silver under his seal.,Interval adjusted: starts at token 9 not 10
89,2.0,a-na wa-aḫ-šu-ša-na a-na ṣé-ri-kà ub-lam-ma um-ma a-na-ku-ma KÙ.BABBAR le-qé-ma ša-du-a-tám ša a-šu-mì ku-li-a ša ta-pu-lu šu-qú-ul,I brought it to Wahšušana to you and I said to you: Take this silver and pay (with it) the šaddu'utu-tax on behalf of Kuliya, as you promised.
90,3.0,um-ma a-ta-ma ke-na KÙ.BABBAR a-pu-ul,You answered: Indeed I did promise to pay that silver.,
91,4.0,ku-nu-ki ša a-ḫi-kà IGI a-šùr-lá-ma-sí DUMU a-šur-ma-lik ù šu-iš-ḫa-ra DUMU i-na-sú-in li-me-e áp-qí-da-kum,In the presence of Aššur-lamassī, son of Aššur-mālik
92,5.0,mì-nam a bé-et a-bi-a al-qé-ma a-ḫu-kà i-tù-ra-am,What did I take for my paternal house that your brother came back on me?,
93,6.0,i-na al tí-im-ni-e IGI ú-zu-a DUMU ku-ku-lá-nim ù i-na-sú-en₆ DUMU i-dí-a-bi₄-im ta-aṣ-bi₄-tí-ma um-ma a-ta-ma i-nu-mì KÙ.BABBAR ku-nu-ki ša a-ḫi-a ta-dí-na-ni ma-nu-um li-mu-um,In Al-Timniyē, in the presence of Uzua
94,7.0,um-ma a-na-ku-ma lá a-šùr-lá-ma-sí ú šu-iš-ḫa-ra li-mu-ú,I answered: Were Aššur-lamassī and Šu-Išhara no līmums?,
95,8.0,ù ma-aḫ-ri-šu-nu-ma KÙ.BABBAR ku-nu-ki ša a-ḫi-a áp-qí-da-kum,And it was in their presence that I entrusted you the silver with my brother's seals.,
96,17eabcc2-84f1-4fb0-b151-af6331cb4d17_0,0.5 ma-na KÙ.BABBAR ṣa-ru-pá-am i-ṣé-er šu-mì-a-bi₄-a e-lá-ma i-šu,0.5 mina of refined silver Šumi-abiya owes to Elamma.,Suggested interval (6-9) was misplaced; debt statement spans from start through i-šu (token 7)
97,17eabcc2-84f1-4fb0-b151-af6331cb4d17_1,iš-tù ḫa-muš-tim ša DINGIR-na-da 1 GÍN.TA ṣí-ib-tám i ITU.1.KAM ú-ṣa-áb,From the week of Ilī-nādā he will add 1 shekel of silver as interest per month.,Interval adjusted to tokens 8-17; matches interest clause
