,oare_id,aligned_transliteration,aligned_translation,comment
553,4.0,ki-ma ku-pá-um ma-du-ni a-na lu-qú-ut DAM.GÀR-ri-im ša ki-ma qá-qí-dí-a ú-lá áš-tap-ra-am,"Because there is a lot of snow, I have not sent anyone on whom I could rely for the goods of the merchant.",Interval 59-70 confirmed; ki-ma ku-pá-um = because of snow
554,5.0,i-na na-áp-ṭí-ir ku-nu-tí ù a-na-ku ú-lá ša ki-ma qá-qí-dí-a a-ṭa-ra-dam-ma mì-li-ik lu-qú-tim ša DAM.GÀR a-ma-lik,"At the opening of snows, then I shall send either myself or someone I can rely on, and I shall make a decision about the merchant's goods.",Interval 70-85; na-áp-ṭí-ir ku-nu-tí = release/opening of the cold/snow
555,6.0,mì-šu ša ta-áš-pu-ra-ni um-ma a-ta-ma tí-ir-tí DAM.GÀR ḫi-mì-tum i-li-kam,"What is that you wrote, saying: ""A heated letter from the merchant came.""",Interval 85-94 confirmed; mì-šu = what/why
556,7.0,a-na-ku sà-aḫ-ra-ku-ma a-na lu-qú-tim ša DAM.GÀR mì-li-ik-ša ma-lá-kam lá a-al-té-e,"I have personally been delayed and been unable to take any decision about the merchant's goods.""",Interval 94-104 confirmed
557,8.0,ba-a-nim i-a-tí ta-ša-pá-ra-am,"Come on, it is to me you write!",Interval 104-107 confirmed; ba-a-nim = come on/indeed
558,9.0,a-pu-t[...],"Urgent, guard the goods of the merchant;",Transliteration is truncated; a-pu-t is beginning of a-pu-tam (urgent); remainder of tablet not provided in source
559,10.0,[remainder of tablet not preserved in provided transliteration],"and with regard to your message where you said: ""There are some old textiles"" --urgent, the very day you hear my letter you and Ilī-ašranni should air all of the textiles in the storeroom of a friend, and leave them for 3 or 5 days before you turn them over.",Transliteration truncated; interval 113-145 not available in provided source text
560,11.0,[not preserved in provided transliteration],Do not let anyone else approach (them).,Transliteration truncated; interval 145-149 not available
561,12.0,[not preserved in provided transliteration],Do not hesitate for 10 days!,Transliteration truncated; interval 149-154 not available
562,13.0,[not preserved in provided transliteration],I have sent Uṣur-ša-Ištar to Enišārum concerning your tin.,Transliteration truncated; interval 154-160 not available
563,14.0,[not preserved in provided transliteration],"When they come back from Zalpa, I shall send Ali-aḫum.",Transliteration truncated; interval 160-166 not available
564,15.0,[not preserved in provided transliteration],I sent Ilī-tūram to you with 1/2 mina of refined silver and small goods worth 3 shekels under my seal.,Transliteration truncated; interval 166-177 not available
565,16.0,[not preserved in provided transliteration],"Idnaya and Aluwa are bringing you 15 shekels of silver, the proceeds from your textile.",Transliteration truncated; interval 177-185 not available
566,17.0,[not preserved in provided transliteration],Your donkeys should be fed.,Transliteration truncated; interval 185+ not available
567,6d6519ac-25a4-4043-a389-616fba75e1d3_0,2 GÍN KÙ.KI i-ṣé-er i-dí-na-bi-im DUMU šu-IŠTAR a-lá-ḫu-um i-šu,Iddin-abum son of Šu-Ištar owes 2 shekels of gold to Ali-ahum.,Suggested interval adjusted from (7
568,6d6519ac-25a4-4043-a389-616fba75e1d3_1,iš-tù ITU.1.KAM ḫu-bu-ur a-na ITU.2.KAM i-ša-qal,Reckoned from the month hubur he will pay in 2 months.,Suggested interval (9
569,6d6519ac-25a4-4043-a389-616fba75e1d3_2,šu-ma lá iš-qú-ul ki-ma a-wa-at kà-ri-im ṣí-ib-tám ú-ṣa-áb,If he has not paid in time he will add interest according to the rule of the colony.,Interval (15
570,6d6519ac-25a4-4043-a389-616fba75e1d3_3,li-mu-um ṣí-lu-lu IGI e-lá-lí DUMU i-pí-li-is IGI bi-sá-a IGI bé-lúm-ba-ni DUMU a-šur-be-el-a-wa-tim,Eponym: Ṣilulu. Witnessed by Elāli son of Ippilis by Bisaya by Bēlum-bāni son of Aššur-bēl-awātim.,Eponym and witness list (23
571,6d6c3ebc-e476-4fab-9b53-2e657d9f8a10_0.0,a-na a-la-ḫi-im qí-bi₄-ma um-ma PUZUR₄-a-šur-ma,To Ali-ahum from Puzur-Aššur:,Standard Old Assyrian epistolary opening formula; interval (0-72) fits this greeting segment well
572,6e48d9bc-0fd2-4499-9586-2ab402003260_0.0,5 ma-na KÙ.BABBAR ṣa-ru-pu-um i-na ší-im SÍG.ḪI.A ša ú-ší-na-lam PUZUR₄-ša-du-we DUMU lá-qé-ep il₅-qé,Puzur-šadu'e son of Lā-qēp has received 5 minas of refined silver from the proceeds of Ušinalam's wool.,Suggested interval (1-13) was adjusted to include il₅-qé (token 13) which is the main verb closing the transaction clause.
573,6e48d9bc-0fd2-4499-9586-2ab402003260_1.0,IGI a-šùr-GAL DUMU ma-nu-um-šu-um-šu IGI en-na-sú-in DUMU i-dí-a-bi-im IGI i-dí-a-šùr bu du ú,Witnessed by Aššur-rabi son of Mannum-šumšu by Enna-Suen son of Iddin-abum by Iddin-Aššur.,Witness list begins at IGI (token 14); tokens bu du ú at end are likely scribal marks or damaged text.
574,0.0,a-ḫu-a a-tù-nu a-dí ma-lá ù ší-ni-šu té-er-tí i-li-kà-ku-nu-tí,My dear brothers once or twice I have sent word to you.,Interval adjusted leftward; header tokens 0-6 excluded; segment begins at a-ḫu-a
575,1.0,i-na ṣú-ba-tí ša tám-kà-ri-im ṣú-ba-tù an-ḫu-tù-um i-ba-ší-ú i-ḫi-id-ma <gap> mì-li-ik ṣú-ba-tim mì-il₅-kà,Among the textiles belonging to the merchant there are some old textiles. Do take a decision concerning the goods.,Interval extended to include i-ḫi-id-ma and counsel clause which belong to this segment
576,2.0,1 TÚG SIG₅ a-lu-a na-áš-a-ku-nu-tí a-ma-kam iš-tí ší-im AN.NA-ki-a KÙ.BABBAR šé-bi₄-lá-ni-ma gi-im-lá-ni,Aluwa is bringing you 1 fine textile. There you should send me silver together with the proceeds from my tin thus doing me a favour.,Remainder of text included; closing clauses attached here
577,0.0,ša ḫu-bu-ul i-dí-a-bi₄-im 20 ma-na KÙ.BABBAR ṣa-ru-pá-am iš-tù ḫa-mu-uš-tim ša li-ba-a,Concerning the debt of Iddin-abum: Reckoned from the week of Libbaya he must pay 20 minas of refined silver,Interval adjusted from (8-19) to tokens 8-18; seal introductions excluded as preamble
578,1.0,a-na 13 ḫa-am-ša-tim i-ša-qal,within 13 weeks.,Interval adjusted to tokens 19-22
579,2.0,šu-ma lá iš-qú-ul 1.5 GÍN.TA i-na ITU.KAM a-na 1 ma-na-im ú-ṣa-áb,If he has not paid (in time) he must pay interest at the rate 1.5 shekel per month per mina.,Interval adjusted to tokens 23-33
580,3.0,šu-ma lá-ma u₄-mu-šu im-lu-ú-ni ṭup-pu-šu ša na-ru-qí-šu il₅-ta-áp-tù 5 ma-na KÙ.GI šu-mì šu-{d}EN.LÍL i-lá-pá-at,If they have written the tablet for his joint-stock investment before the completion of his term he shall book 5 minas of gold in Šu-Illil's name.,Guide segment 3.0 only had 'If'; extended to full clause tokens 34-47
581,719bdc03-0156-416d-b5ef-c0f20e246278_0.0,a-na a-lá-ḫi-im qí-bi-ma um-ma SIG₅-pí-a-šur-ma,To Al-aḫum from Damiq-pī-Aššur:,Standard Old Assyrian epistolary opening formula; SIG₅ is a logogram for Damiq; interval slightly adjusted to capture full greeting formula
582,0.0,a-na {d}MAR.TU-ba-ni a-šùr-i-mì-tí ṣí-lu-lu šu-ku-bi₄-im en-nu-um-DINGIR a-šùr-dan ili₅-ba-ni en-na-sú-in LUGAL-{d}IM ù zi-ki-ki qí-bi-ma um-ma ša-lim-a-šùr-ma,"To Amurrum-bāni, Aššur-imittī, Ṣilūlu, Šu-Kūbum, Ennam-ilī, Aššur-dan, Ilī-bāni, Enna-Suen, Šar-Adad and Zikiki from Šalim-Aššūr:",Addressees and sender; interval 0-15 adjusted to end of greeting formula
583,1.0,ṭup-pá-am ša kà-ri-im bu-ru-uš-ḫa-dim ṣa-ḫe-er GAL ù ṭup-pá-am ša ú-ší-na-lam DUB.SAR ša kà-ri-im bu-ru-uš-ḫa-dim DUMU i-ba-a ú ṣú-ḫa-ru-um ša ú-ší-na-lam a-na kà-ri-im kà-ni-iš ṣa-ḫe-er GAL a-šu-mì a-bu-ša-lim ÌR ub-lu-nim,"The scribe of the Burušhaddum colony, Ibaya's son and a servant of Ušinalam have brought a tablet from the plenary assembly of the Burušhaddum colony and a tablet from Ušinalam to the plenary assembly of the Kanesh colony concerning the slave Abu-šalim.",Interval 15-44; describes the messengers and their tablets
584,2.0,um-ma šu-nu-ma 16 li-me-e 40 ma-na URUDU ší-im SÍG.ḪI.A a-bu-ša-lim ÌR a-na ú-ší-na-lam ḫa-bu-ul 30 li-me-e URUDU ša nam-e-dim ša É.GAL-lúm ḫa-bu-lu ú-ší-na-lam ú-ṣa-li-im,"They said: ""The slave Abu-šalim owes 16,040 minas of copper, the price of wool, to Ušinalam. As to the 30,000 minas of copper from the others that they owe to the palace, he angered Ušinalam.""",Interval 44-68; direct speech reporting debts
585,3.0,um-ma šu-nu-ma a-bu-ša-lim li-li-kam šu-ma a-bu-ša-lim lá-šu bé-el-šu le-tí-qám a-na-kam a-na na-áp-ša-tí-ni ù KÙ.BABBAR-áp a-bu-ša-lim ni-ša-ḫu-ut ší-ip-ru ša a-lim{ki} ku-lu-šu-nu-ma ù kà-ru-um kà-ni-iš ṭup-pí-šu-nu iš-ta-me-ú-ma,"They went on: ""Abu-šalim must come. If Abu-šalim is absent, his master must travel. Here we fear for our lives and Abu-šalim's silver."" When all of the envoys from the City and the Kanesh colony had heard their letters,",Interval 68-93; second direct speech and reaction of envoys
586,4.0,um-ma šu-nu-ma ú-ší-na-lam tù-ṭá-áb a qá-tí ili₅-ba-ni DUB.SAR kà-ri-im bu-ru-uš-ḫa-dim ù ṣ,"they said: ""You will have to satisfy Ušinalam."" They handed me to Ilī-bāni, the scribe of the Burušhaddum colony and Ušinalam's servant together with my merchandise that had come up from the City,",Interval 93-105; text breaks off mid-sentence at end of preserved transliteration
587,5.0,[text not preserved in provided transliteration],and,Suggested interval (114-105) is inverted; segment represents continuation; no transliteration text available in provided excerpt
588,6.0,[text not preserved in provided transliteration],"I said: ""It is you I have satisfied, so take the iṣurtu-documents you gave to me and sell them where you wish.""",Suggested interval (141-105) is inverted; no transliteration text available in provided excerpt
589,7.0,[text not preserved in provided transliteration],"He answered: ""I will not take the iṣurtu-documents, but you must pay (in accordance with) those other tablets.""",Suggested interval (153-105) is inverted; no transliteration text available in provided excerpt
590,8.0,[text not preserved in provided transliteration],"Before the envoys of the Kanesh colony and the plenary assembly of the colony at Burušhaddum I said this to Ušinalam, but he refused.",Suggested interval (163-105) is inverted; no transliteration text available in provided excerpt
591,9.0,[text not preserved in provided transliteration],"My dear lords, as for the tablet from the plenary assembly of the Burušhaddum colony and the tablet from Ušinalam that Ibaya's son and Ušinalam's servant brought, that the envoys from the City and the Kanesh colony heard and on the basis of which tablets they led me away, and I did satisfy Ušinalam - both those earlier tablets which the envoys of the City and the plenary assembly of the Kanesh colony heard, and that have been entrusted (for safe-keeping), and a tablet, a missive from the plenary assembly of the Burušhaddum colony to the plenary assembly of the Kanesh colony that Ilī-bāni and huraṣānum bring - when the colony has heard it, you too must submit to the colony, so that you, together with the Kanesh colony, give the two previous tablets transported by the scribe, Ibaya's son, and Ušinalam's servant, plus this tablet transported by Ilī-bāni and huraṣānum to Buziya, the envoy from the City - those three tablets - so they entrust them in your presence in order that Buziya may carry them to the City.",Suggested interval (180-105) is inverted; no transliteration text available in provided excerpt
592,10.0,[text not preserved in provided transliteration],"If the colony has not given the tablets to Buziya, send me word, so that I can set out and come so my city and my lord may give me justice.",Suggested interval (291-105) is inverted; no transliteration text available in provided excerpt
593,11.0,[text not preserved in provided transliteration],"If Buziya has left, then entrust the tablet that Ilī-bāni and huraṣānum bring to a reliable affiliated trader (for safe-keeping).",Suggested interval (306-105) is inverted; no transliteration text available in provided excerpt
594,7446a8ba-6379-4450-91de-581a7fe38565,šu-ma lá iš-qúl ki-ma a-wa-at kà-ri-im 1.5 GÍN.TA i-na ITU.KAM-im a-na 1 ma-na-im ṣí-ib-tám ú-ṣa-áb,If he does not pay he will add in accordance with the regulation of the colony an interest of 1.5 shekel per month per mina.,Interval (41-104) slightly misplaced; segment begins at šu-ma lá iš-qúl corresponding to the conditional clause about non-payment and interest addition per colony rate.
595,74ae5e3d-9eed-4d9e-a787-30a1d806ca8f-0.0,i-na-sú-in dan-a-šur e-pu-ul,Enna-Suen answered Dan-Aššur.,The verb e-pu-ul (answered) with subject i-na-sú-in and object dan-a-šur corresponds to the first sentence; um-ma follows as the speech introducer for the next clause. Suggested interval (0-63) is slightly too broad; the sentence break falls after e-pu-ul.
596,76214fc1-7b69-4668-98fd-201fb9fe8f8e_0.0,KIŠIB a-ku-za DUMU šu-a-nim KIŠIB MAR.TU-ba-ni DUMU ma-na-na KIŠIB lá-qé-ep DUMU PUZUR₄.IŠTAR,Sealed by Akuza son of Šu-Anum by Amurrum-bāni son of Manana by Lā-qēp son of Puzur-Ištar.,Interval (0-12) correct; seal impressions of three witnesses.
597,76214fc1-7b69-4668-98fd-201fb9fe8f8e_1.0,a-na a-wa-tim a-ni-a-tim kà-ru-um kà-ni-iš-ki i-dí-ni-a-tí-ma IGI GÍR ša a-šùr ší-bu-tí-ni ni-dí-in,The Kanesh colony gave us for these proceedings and we gave our testimony before Aššur's dagger.,Interval (12-24) correct; main legal clause.
598,76214fc1-7b69-4668-98fd-201fb9fe8f8e_2.0,i-tur₄-DINGIR DUMU a-mur-IŠTAR tap-pá-i-ni,Itūr-ilī son of Amur-Ištar was our (absent) partner.,Interval (24-28) correct; four words closing the tablet.
599,0.0,10 ma-na KÙ.BABBAR ša i-dí-a-bu-um a-na kà-ri-im iḫ-bu-lu 1 ma-na-um 4 GÍN ni-iṣ-ḫi-ir-ma 9.3333 ma-na KÙ.BABBAR ṣa-ru-pá-am iš-tí ša-lim-a-ḫi-im i-dí-a-šùr DUMU ba-bi₄-lim ù PUZUR₄-a-šùr li-ma-an il₅-qé-ma iš-tù ḫa-mu-uš-tim ša a-ku-za 1.5 GÍN.TA i-na ITU.KAM a-na 1 ma-na-im ú-ṣa-áb,"Of the 10 minas of silver that Iddin-abum owes to the colony we deducted 4 shekels per mina and the two eponyms, Iddin-Aššur son of Babilum and Puzur-Aššur, received 9.3333 minas of refined silver from Šalim-ahum, and reckoned from the week of Akuza he will pay interest at the rate 1.5 shekel per month per mina.",Main body of the tablet; suggested interval adjusted to capture full main clause ending at ú-ṣa-áb
600,1.0,IGI a-šur-{d}UTU-ši IGI i-dí-a-šur DUMU a-šur-ma-lik,"Witnessed by Aššur-šamšī, by Iddin-Aššur son of Aššur-malik.",Witness clause; IGI formula marks clear break from main text
601,0.0,1.3333 ma-na KÙ.BABBAR i-na KÙ.BABBAR-áp a-bu-ša-lim DUMU e-na-su-in ša ḫu-ut-<gap> a-na a-na-aḫ-ì-lí DUMU DU₁₀-ṣí-lá-a-šur i-dí-nu-ma ṭup-pu-šu iḫ-ri-mu-ma i-na ṭup-pí-im ša ku-nu-uk a-na-aḫ-ì-lí lu šu-mì a-bu-ša-lim ú-du-ú lu šu-mì DAM.GÀR ú-du-ú KÙ.BABBAR u ṣí-ba-sú ša ṭup-pí-im šu-wa-tí a-šur-ma-lik DUMU ku-ra-ra ku-li-a DUMU a-lá-bi₄-im ù šu-be-lim DUMU pu-qí-dí ša ki-ma a-šur-DU₁₀ DUMU a-bu-ša-lim ša-bu-ú,"1.3333 mina of silver from the silver of Abu-salim, son of Ennam-Suen, which Hut-x <gap> gave to Anah-ili, son of Tab-silli-Assur, and for which he drew up a valid record and in which tablet, sealed by Anah-ili, either the name of Abu-salim or simply ""the creditor"" is indicated - with the silver and the interest on it, of the afore-mentioned tablet, Assur-malik, son of Kurara, Kuliya, son of Ali-abum, and Su-Belum, son of Puqidi, the representatives of Assur-tab, son of Abu-salim, are satisfied.",Interval adjusted to end at word 52 (ša-bu-ú); proposed end was 53 which belongs to next segment
602,1.0,ṭup-pu-um ša ḫu-bu-ul a-na-aḫ-ì-lí ša i-li-a-ni sà-ar,The tablet of the debt of Anah-ili that may turn up is invalid.,Interval 53-59; proposed interval was 53-60 but word 60 (ma-tí-ma) starts the conditional clause
603,2.0,ma-tí-ma a-na-aḫ-ì-lí a-na a-šur-ma-lik ku-li-a ù šu-be-lim i-tu-ru ṭup-pá-am ḫa-ar-ma-am ša ma-nu-um-me <gap> ú-bu-lu-nim-ma ṭup-pu-um a-num i-mu-a-at,"If ever Anah-ili should raise a claim against Assur-malik, Kuliya and Su-Belum, they will bring the valid record of Mannum-mu <gap> and then this tablet will be cancelled.",Interval 60-76; aligns well with proposed interval 60-77
604,3.0,IGI IŠTAR-tù-li-id DUMU a-da-a IGI bu-da-a DUMU ta-ra-wa-zi,"In the presence of Istar-tulid, son of Adaya, of Budaya, son of Tarawazi.",Interval 77-84; matches proposed interval exactly
605,7b17e821-ad61-4a1b-b54a-952d13b40793_0.0,KIŠIB a-ku-za KIŠIB la-li-im KIŠIB šu-ku-bi-im DUMU a-zu KIŠIB a-šùr-i-mì-tí DUMU i-ku-pì-IŠTAR KIŠIB i-tur₄-DINGIR DUMU a-mur-IŠTAR,Sealed by Akuza, by Lalum
606,7b17e821-ad61-4a1b-b54a-952d13b40793_1.0,ṭup-pu-um ša ba-áb DINGIR-lim ša ší-bu-tí-šu-nu ša IGI GÍR ša a-šùr,The tablet from the Gate of the God with their testimony from before Aššur's dagger.,Interval (16-27) is correct; covers the full tablet description clause.
607,7ba84024-458e-4452-93b5-073052e72b24,i-ku-pí-a ù e-ri-ší-im qí-bi-ma um-ma en-um-a-šur-ma a-na e-ri-ší-im qí-bi-ma a-ḫi a-ta tí-ir-tí a-bi-ni a-na KÙ.BABBAR 10 ma-na šé-bu-li-im i-li-kam,My dear brother an order from our father arrived about sending some 10 minas of silver.,Interval (10-113) covers the opening address formula and first statement; guide translation 'My' anchors to 'My dear brother' (a-ḫi a-ta) within this segment.
608,7c864e0e-4aa7-48b7-8b93-ec018ec1a719_0,1 GÚ URUDU SIG₅ a-lu-lu-ur ù me-er-ú-šu il₅-qé 1 ma-na ù 1 GÍN.TA KÙ.BABBAR-áp-šu 1 ma-na,Alulur and his son received 1 talent of good copper. The rate in silver: 61 to 1.,Covers the receipt of copper and the silver rate (tokens 0–15)
609,7c864e0e-4aa7-48b7-8b93-ec018ec1a719_1,iš-tù ḫa-mu-uš-tim ša kur-ub-IŠTAR DUMU PUZUR₄.DINGIR a-na 2 ITU.KAM i-ša-qú-lu šu-ma lá iš-qú-lu ú 3 GÍN,From the ḫamuštum of Kurub-Ištar s. PUZUR₄.DINGIR he has 2 months to pay. If he does not pay 3 shekels,Interval adjusted to start at token 16; break at token 31 before interest rate detail
610,7c864e0e-4aa7-48b7-8b93-ec018ec1a719_2,ṣí-ib-tám i-na ITU.KAM-im a-na ma-na-im ú-ṣú-bu IGI ta-bi-a IGI kà-ma-li-a,interest per month per mina will be added. Witnessed by Tabia (and) Kamalia.,Covers interest clause and witnesses; interval starts at token 32
611,7e550d5e-f40f-430f-9dfe-2c4a5ebaa29e_0,É ša kà-ni-iš É-be-et ḫi-na-a ša a-šar ili₅-ba-ni na-lu-ni šu-ma É-té šu-nu ša ku-li-a i-tù-ru-ú 0.3333 ma-na 4 GÍN KÙ.BABBAR ša ší-im É-té šu-nu-tí en-um-a-šur a-na PÚZUR-a-šùr iš-qú-lu ší-be-e en-um-a-šùr a-na ku-li-a ú-šé-lá-ma 0.5 ma-na KÙ.BABBAR ku-li-a a-na en-um-a-šùr i-ša-qal,The house in Kanesh the house of Hinnaya where Ili-bani lies buried should that house become Kuliya's property then for the 24 shekels of silver that Ennum-Assur paid as price for this house to Puzur-Assur Ennum-Assur will produce witnesses against Kuliya and Kuliya will pay to Ennum-Assur 0.5 mina of silver.,Interval 0-40 confirmed; break before šu-ma at token 40
612,7e550d5e-f40f-430f-9dfe-2c4a5ebaa29e_1,šu-ma É-té šu-nu-tí ku-li-a lá il₅-qé a-na KÙ.BABBAR-pì-šu wa-ší-ib bé-tim en-um-a-šùr i-šé-e,Should Kuliya not acquire that house then Ennum-Assur will sue the resident of that house for his silver.,Interval 40-52 confirmed; break before IGI at token 52
613,7e550d5e-f40f-430f-9dfe-2c4a5ebaa29e_2,IGI a-šùr-ták-lá-ku DUMU kàr-wa-a IGI ÌR-ad-a-šùr DUMU DIRI-e-im,In the presence of Assur-taklaku son of Karwaya of Urad-Assur son of Watrum.,Interval 52-60 confirmed; witness list to end of text
614,0.0,kà-ru-um dí-nam i-dí-in-ma ša 2.5 GÚ 7 ma-na KÙ.BABBAR 1 ma-na KÙ.GI ù 4 TÚG ku-ta-ni lá-qé-e KÙ.BABBAR-pì-im ša i-dí-a-bi₄-im iš-ra-tim ša ru-ba-im ša-lim-a-šùr ú-ṣa-ḫa-ar,"The colony has passed a verdict, stating that of the 2.5 talents 7 minas of silver, 1 mina of gold and 4 kutānum-textiles the recipient of Iddin-abum's silver will deduct the tithe of the king (from) Šalim-Aššur.",Interval adjusted to include ú-ṣa-ḫa-ar (token 24) in segment 0
615,1.0,ù i-na dí-in tám-kà-ru-tim e-ta-wu,Then they will discuss in a court of merchants.,Interval corrected to start at token 25 (ù) through token 29 (e-ta-wu)
616,2.0,šu-ma KÙ.BABBAR i-na iš-ra-tim ba-tí-iq ša-lim-a-šùr i-na-dí,"If the silver is insufficient for the tithe, Šalim-Aššur will deposit (what is missing).",Interval runs from token 30 to end (token 36)
617,7fa17202-7bf5-4f5f-b1ea-bc809a783ba9_0.0,a-na a-lá-ḫi-im qí-bi-ma um-ma PÚZUR-a-šur,To Ali-ahum from Puzur-Aššur:,Standard Old Assyrian epistolary opening formula; interval (0
618,803449c3-3581-4dbc-b973-a2a65254b224_0.0,ša ḫu-bu-ul i-dí-a-bi-im,Concerning the debt of Iddin-abum.,"Suggested interval was (12-19) but tokens 12-14 capture ""ša ḫu-bu-ul i-dí-a-bi-im""; interval start adjusted to 12 which is correct; end was too late"
619,803449c3-3581-4dbc-b973-a2a65254b224_1.0,5 ma-na KÙ.BABBAR ṣa-ru-pá-am i-ṣé-er i-dí-a-bi-im a-šur-{d}UTU-ši i-šu,Iddin-abum owes 5 minas of refined silver to Aššur-šamši.,"Interval adjusted from (19-27) to tokens 15-22; ""i-šu"" closes the ownership clause"
620,803449c3-3581-4dbc-b973-a2a65254b224_2.0,iš-tù ḫa-mu-uš-tim ša a-mur-IŠTAR a-na 23 ḫa-am-ša-tim i-ša-qal,Reckoned from the week of Amur-Ištar he must pay within 23 weeks.,Interval adjusted from (27-38) to tokens 23-30
621,803449c3-3581-4dbc-b973-a2a65254b224_3.0,šu-ma i-na ma-lá u₄-me-šu la iš-qú-ul 1.5 GÍN.TA i ITU.KAM a-na ma-na-im ú-ṣa-áb,If he has not paid within his stipulated term he must pay interest at the rate 1.5 shekel per month per mina.,Interval (38-44) adjusted to tokens 31-43; covers full penalty clause
622,814ad661-c264-4d94-9c1e-2273334268e6_0,<gap> ig-re ag-ri-im a-bi-a-a DUMU ú-zu-a ú-ma-lá 2 GÍN lu-bu-šu ša-bu,[broken] the wages of the hireling Abiaya, son of Uzua will compensate; he has been paid 2 shekels (of silver) as his clothing allowance.
623,814ad661-c264-4d94-9c1e-2273334268e6_1,KIŠIB en-um-a-šur DUMU i-ku-pí-a KIŠIB a-ni-na-a DUMU DIRI-im KIŠIB e-na-a-šur DUMU šu-ul-mì-ša-a-šùr,"Seal of Ennum-Aššur, son of Ikuppia, seal of Aninaya, son of Watrum, seal of Ennam-Aššur, son of Šulmi-ša-Aššur.",Interval (12-23) matches suggested (11-24) closely; DIRI-im = Watrum
624,814ad661-c264-4d94-9c1e-2273334268e6_2,12 ma-na URUDU ší-kam i-ṣé-er en-um-a-šùr DUMU i-ku-pí-a DAM.GÀR i-šu,"12 minas of šikku-copper Ennum-Aššur, son of Ikuppia, owes to the creditor.",Interval (24-33) matches suggested interval well
625,814ad661-c264-4d94-9c1e-2273334268e6_3,iš-tù SAG ITU.KAM tí-i-na-tim a-na ITU.KAM i-ša-qal,Reckoning from the beginning of the month Tēinātum he will pay in one month.,Interval (34-40); suggested (33-40) adjusted by 1
626,814ad661-c264-4d94-9c1e-2273334268e6_4,šu-ma lá iš-qú-ul a-na 10 ma-na na-e 0.5 ma-na.TA i-na ITU.KAM ṣí-ib-tám ú-ṣa-áb,If he does not pay he will add an interest of 1/2 mina per 10 minas per month.,Interval (41-53) matches suggested (40-53)
627,814ad661-c264-4d94-9c1e-2273334268e6_5,li-mu-um da-dí-a DUMU šu-{d}NIN.ŠUBUR,"Eponymy of Dadiya, son of Šu-Ilabrat.",Interval (54-57) matches suggested (53-57)
628,814ad661-c264-4d94-9c1e-2273334268e6_6,wa-bi₄-il₅ ṭup-pì-im šu-ut DAM.GÀR,The bearer of the tablet is the creditor.,Interval (58-61) matches suggested (57-61)
629,814ad661-c264-4d94-9c1e-2273334268e6_7,KIŠIB ḫi-ta-ni DUMU DINGIR-na-da KIŠIB en-um-a-šùr DUMU <gap> KIŠIB a-mur-a-šùr DUMU i-šar-ki-it-a-šùr KIŠIB ku-na-na-a,"Seal of Hitani, son of Ilī-nādā, seal of Ennum-Aššur, son of [..........], seal of Amur-Aššur, son of Išar-kitti-Aššur, seal of Kunnanaya.",Interval (62-75) matches suggested (61-78) adjusted to end before the numeral
630,814ad661-c264-4d94-9c1e-2273334268e6_8,2 GÚ 10 ma-na URUDU ší-kam i-na a-ba-an ma-tim i-ṣé-er ku-na-na-a ku-li-a DUMU a-lá-bi₄-im i-šu,"2 talents 10 minas of šikkum copper, by the local weight standard, Kunnanaya owes to Kuliya, son of Ali-abum.",Interval (76-91) matches suggested (78-92) adjusted to start at numeral
631,814ad661-c264-4d94-9c1e-2273334268e6_9,iš-tù ITU.KAM qá-ra-a-tim li-mu-um a-šùr-SIPA DUMU ì-lí-e-mu-qí ki-ma a-wa-at kà-ri-im 1.5 ma-na.TA a-na 1 GÚ-tim i-na ITU.KAM ṣí-ib-tám ú-ṣa-áb,"Reckoning from month VIII, eponymy of Aššur-rē'ī, son of Ilī-emūqī, in conformity with the rule of the kārum, he will add an interest of 1 1/2 mina per talent per month.",Interval (92-109) matches suggested (92-111) adjusted; qá-ra-a-tim = month VIII
632,814ad661-c264-4d94-9c1e-2273334268e6_10,ÌR a-bi₄-ì-lí ù ri-ki-sú a-na 3.5 GÍN KÙ.BABBAR SAḪAR.BA ku-a-li DUMU a-lá-bi₄-im iš-tí {d}UTU,"The slave Abī-īlī with his fetter for 3 1/2 shekels of 'dust silver' Kuliya, son of Ali-abum bought from Šamaš-[dugul son of Ibni-Adad] [text breaks off]",Interval (110-123); text ends mid-sentence with {d}UTU (beginning of Šamaš-dugul); remaining content in segments 11-13 is not present in the provided transliteration
633,814ad661-c264-4d94-9c1e-2273334268e6_11,[not present in transliteration],Šamaš-dugul is satisfied with the silver the price of Abī-īlī and his fetter.,Suggested interval (133-123) is invalid (start > end); content absent from provided transliteration
