,oare_id,aligned_transliteration,aligned_translation,comment
270,2.0,a-na wa-aḫ-šu-ša-na a-na ṣé-ri-kà ub-lam-ma um-ma a-na-ku-ma a-ma KÙ.BABBAR i-na ku-nu-ki ša ku-li-a áp-qí-da-ku-um,I brought to Wahšušana to you and I said: Herewith I entrust to you silver under the seals of Kuliya.,Tokens 15-28
271,3.0,KÙ.BABBAR ša a-šu-mì ku-li-a ša-du-a-tám kà-ra-am ta-pu-lu,It is silver you promised to pay the kārum as šad-du'utu-tax on behalf of Kuliya.,Tokens 29-35; ša-du-a-tám = šaddu'ātum tax; kà-ra-am = kārum
272,4.0,um-ma a-ta-ma ke-na a-pu-ul KÙ.BABBAR,Yes I promised it.,Tokens 36-40; KÙ.BABBAR here part of the acknowledgment formula; um-ma a-ta-ma = 'you said'
273,5.0,IGI a-šùr-lá-ma-sí DUMU a-šur-ma-lik ú šu-iš-ḫa-ra DUMU e-na-sú-in li-me-e ri-ik-sà-am áp-qí-da-kum,"In the presence of Aššur-lamassī, son of Aššur-mālik, and of Šu-Išhara, son of Ennam-Suen, the līmū, I entrusted the packet to you.",Tokens 41-51; li-me-e = līmū (eponym officials); ri-ik-sà-am = packet/bundle
274,6.0,mì-nam a-na É a-bi₄-a al-qé-ma a-ḫu-kà i-tù-ra-am,What did I take for my paternal house that your brother came back on me?,Tokens 52-58; rhetorical question
275,7.0,i-na al tí-im-ni-e ta-am-ḫu-ri-ma IGI e-na-sú-in DUMU i-sú-rik₁₃ ù IGI ú-zu-a DUMU ku-ku-lá-nim ta-áš-e-li-ma um-ma a-ta-ma i-nu-mì KÙ.BABBAR ku-nu-ki ša a-ḫi-a tù-šé-bi₄-lá-ni ma-num li-mu-um,"In Al-Timniyē you approached me and in the presence of Ennam-Suen, son of Issūrik, and of Uzua, son of Kukkūlānum, you interrogated me saying: When you had me bring the silver with my brothers' seals, who was then līmum?",Tokens 59-82; al tí-im-ni-e = Al-Timniyē; ku-ku-lá-nim = Kukkūlānum
276,8.0,um-ma a-na-ku-ma a-šùr-lá-ma-sí ú šu-iš-ḫa-ra li-mu-ú ù ma-aḫ-ri-šu-nu-ma KÙ.BABBAR áp-qí-da-kum,"I answered: Aššur-lamassī and Šu-Išhara were līmū, and it was in their presence that I entrusted you the silver.",Tokens 83-92
277,9.0,ú-ṣur-ša-IŠTAR DUMU da-da-a i-na né-eḫ-ri-a aṣ-ba-at-ma 1 ma-na ší-a-ma-tí-šu a-na 4 ma-na KÙ.BABBAR i-tù-ur-šu-ma a-wa-at-ni,"I seized Uṣur-ša-Ištar, son of Dadaya, in Nehriya and merchandise of his worth 1 mina had become 4 minas of silver for him and so our affair was cleared up.",Tokens 93-107; a-wa-at-ni = our affair; i-tù-ur-šu-ma = it turned/became
278,10.0,[broken],I booked 1 mina of silver as due by him.,Beyond preserved transliteration; tablet broken
279,11.0,[broken],"[x] silver Iddin-Aššur, son of Šu-Bēlum, promised me [in a letter].",Beyond preserved transliteration; tablet broken
280,12.0,[broken],He will send me the [silver] from what will (come in) from Mamma or from Tegara<ma>.,Beyond preserved transliteration; tablet broken
281,13.0,[broken],............. and by witnesses ............... which he promised ............,Beyond preserved transliteration; heavily broken
282,14.0,[broken],........ due by Aššur-bāni son of [.......] [which .....] .... I myself gave him will be converted into .......,Beyond preserved transliteration; heavily broken
283,0.0,KIŠIB be-lá-nim DUMU šu-ku-bi-im KIŠIB a-gu₅-a DUMU dan-na-a-šur KIŠIB ú-ṣú-ur-ša-IŠTAR DUMU da-da-a,Seal of Bēlānum son of Šu-Kūbum seal of Agua son of Dān-Aššur seal of Uṣur-ša-Ištar son of Dadaya.,Suggested interval (0-13) corrected to (0-11); token 12 ('1') belongs to next segment.
284,1.0,1 ma-na KÙ.BABBAR ṣa-ru-pá-am i-ṣé-er bé-lá-nim DUMU šu-ku-bi-im ku-li-a DUMU a-lá-bi-im i-šu,1 mina of refined silver Bēlānum son of Šu-Kūbum owes to Kuliya son of Ali-abum.,Suggested interval (13-24) corrected to (12-23); token 12 '1' included.
285,2.0,a-na ša-na-at ù 6 ITU.KAM KÙ.BABBAR i-ša-qal,He will pay within one year and six months.,Suggested interval (24-37) corrected to (24-30); tokens 31 onward begin the conditional clause.
286,3.0,šu-ma i-na ú-me-šu ma-al-ú-tim KÙ.BABBAR bé-lá-num lá iš-qú-ul ki-ma a-wa-at kà-ri-im 1.5 GÍN.TA a-na ma-na-im ṣí-ib-tám a-na ur-ḫi-im ú-ṣa-áb,If Bēlānum does not pay when his term is due in conformity with the rule of the kārum he will add 1½ shekels of interest per mina per month.,Suggested interval (37-50) corrected to (31-49); the conditional starts at token 31.
287,4.0,ITU.1.KAM áb-ša-ra-ni li-mu-um i-dí-sú-in DUMU i-dí-a-bi-im,Month V eponymy of Iddin-Suen son of Iddin-abum.,Suggested interval (50-56) corrected to (50-55).
288,5.0,KIŠIB i-ku-pí-a DUMU pí-lá-aḫ-IŠTAR KIŠIB ili₅-ba-ni DUMU mu-ta-lim KIŠIB a-šur-SIPA DUMU ú-ṣú-ra-nim,Seal of Ikuppiya son of Pilah-Ištar seal of Ilī-bāni son of Mutālum seal of Aššur-rēʿī son of Uṣurānum.,Suggested interval (56-69) corrected to (56-67).
289,6.0,8 GÍN KÙ.BABBAR ṣa-ru-pá-am i-ṣé-er i-ku-pí-a DUMU pí-lá-aḫ-IŠTAR ku-li-a DUMU a-lá-bi-im i-šu-ú,8 shekels of refined silver Ikuppiya son of Pilah-Ištar owes to Kuliya son of Ali-abum.,Suggested interval (69-80) corrected to (68-79); token 68 '8' begins the clause.
290,7.0,a-na 6 ur-ḫé KÙ.BABBAR i-ša-qal,He will pay within 6 months.,Suggested interval (80-85) corrected to (80-84).
291,8.0,šu-ma lá iš-qú-ul ki-ma a-wa-at kà-ri-im ṣí-ib-tám ú-ṣa-áb,[If he does not] pay [he will add] interest in conformity with the rule of [the kārum].,Suggested interval (85-95) corrected to (85-92).
292,9.0,<gap> 10 GÍN KÙ.BABBAR be-ú-lá-at ku-li-a DUMU a-lá-bi-im i-na-sú-in DUMU za-ar-ni-qí-im ú-ka-al iš-tí KÙ.BABBAR uk-ta-al,[...] silver a beʾūlātu-loan belonging to Kuliya son of Ali-abum Ennam-Suen son of Zarniqum holds; he is held by the silver.,Suggested interval (95-111) corrected to (93-107); includes <gap> token and through uk-ta-al.
293,10.0,šu-ma šu-ma a-e-ma ú-dá-pí-ir,If he goes away to somebody else.,Suggested interval (111-112) corrected to (108-111); remainder of the transliteration. Note: the full translation of this segment ('he will hire someone in his place and he will compensate the wages of the hireling') likely corresponds to text not preserved in the provided transliteration.
294,11.0,,,Segments 11–15 (Seal of Ilī-mālik through Month V eponymy of Šu-rama) are present in the full translation but the corresponding transliteration tokens are not present in the provided transliteration text; no alignment possible.
295,12.0,,,See comment for segment 11.0.
296,13.0,,,See comment for segment 11.0.
297,14.0,,,See comment for segment 11.0.
298,15.0,,,See comment for segment 11.0.
299,4359bb9c-25a6-4c10-98df-e9166adea494_0,KIŠIB ú-zu-a KIŠIB i-dí-a-bi-im KIŠIB sú-kà-lim DUMU i-dí-sú-in,"Seal of Uzua, seal of Iddin-abum, seal of Sukkallum son of Iddin-Suen.",Introductory seal section before segment 0.0
300,4359bb9c-25a6-4c10-98df-e9166adea494_0.0,11.5 ma-na URUDU ší-ku-um i-ṣé-er sú-kà-lim lu-zi i-šu,Sukkallum owes 11.5 minas of copper to Luzi.,Suggested interval adjusted from (9-16) to (8-16) to include the numeral 11.5; ší-ku-um rendered as quality modifier per high-quality translation
301,4359bb9c-25a6-4c10-98df-e9166adea494_1.0,ITU.KAM áb-ša-ra-ni li-mu-um ku-bi-a ki-ma a-wa-at kà-ri-im ṣí-ib-tám ú-ṣa-áb,Month Ab-šarrāni eponymy Kūbiya. He must add interest in accordance with the rule of the colony.,Interval (16-25) correct; covers date and interest clause
302,0.0,<gap> ú-ṣa-áb ITU.KAM qá-ra-a-tim li-mu-um bu-zu-zu 20 ma-na KÙ.BABBAR i da-na-ma qá-tí a-ša-kà-an,"<gap> month Qarra'ātum, eponymy Buzuzu. He will give me 20 minas of silver and I shall lay claim to that.",Interval adjusted from (0
303,1.0,IGI a-šur-GAL IGI a-šur-{d}UTU-ši IGI pí-lá-aḫ-a-šur,"Witnessed by Aššur-rabi, by Aššur-šamšī, by Pilah-Aššur.",Witness list segment; interval corrected to (13
304,2.0,10 ma-na KÙ.BABBAR ṣa-ru-pu-um iš-tí PUZUR₄-a-na ni-a-im iš-tù-i-ša-qal ḫa-mu-uš-tim ša a-šur-ta-ak-lá-ku ù kà-sí-a a-na 30 ḫa-am-ša-tim,10 minas of refined silver is owed by our own Puzur-Anna. Reckoned from the week of Aššur-taklāku and Kasiya he is to pay in 30 weeks.,Interval corrected to (19
305,3.0,šu-ma lá iš-qúl 0.5 GÍN.TA i-na ITU.KAM a-na 1 ma-na-im ṣí-ib-tám ú-ṣa-áb,"If he has not paid (in time), he will add interest at the rate 1.5 shekel per month per mina.",Interval corrected to (35
306,4.0,ITU.KAM té-i-na-tim li-mu-um a-mur-a-šur IGI PUZUR₄-{d}IM DUMU i-dí-IŠTAR IGI du-um-qá-a DUMU kur-ub-a-a <gap> mu-ḫu-ur-šu <gap> a-ṣé-er KÙ.BABBAR <gap> a-šur-ta-ak-lá-ku <gap> ak-lá-ku <gap>,"Month Te'inātum, eponymy Amur-Aššur son of Karriya. Witnessed by Puzur-Adad son of Iddin-Ištar, by Dumqaya son of Kurub-Ištar. <gap> receive <gap> on top of the silver <gap> Aššur-taklāku <gap>",Interval corrected to (47
307,46417fef-8c27-4092-a5a6-b3dec29c34f2_0.0,KIŠIB a-ku-za DUMU šu-a-nim KIŠIB lá-qé-ep DUMU {d}AB-ba-ni KIŠIB ṣí-lu-lu DUMU ú-ku,Sealed by Akuza son of Šu-Anum, by Lā-qēp son of Illil-bāni
308,46417fef-8c27-4092-a5a6-b3dec29c34f2_1.0,a-na a-wa-tim a-ni-a-tim kà-ru-um kà-né-eš i-dí-ni-a-tí-ma IGI GÍR ša a-šùr i-na ba-áb DINGIR ṭup-pá-am ni-dí-in,The Kanesh colony gave us for these proceedings and we gave a tablet before Aššur's dagger in the Gate of the God.,Interval (12–27) is correct; covers the full legal/procedural clause to end of text.
309,0.0,um-ma a-šùr-ša-dí-li-ma a-na ku-li-a ù a-šur-la-ma-sí a-na ku-li-a qí-bi-ma,Thus says Aššur-šad-ilī to Kuliya and Aššur-lamassī and in particular to Kuliya:,Standard epistolary opening
310,1.0,a-šu-mì a-wa-tim ša É sà-ba-sí-a a-wu-tum ša ma-aḫ-ri-kà lá iz-ku-ú lu-qú-ut-kà ša i-na a-pí-im té-zi-bu-ma lá-ta-ra-ak iṣ-ba-at,Because of the affair of Sabasiya's house the case that was not settled in your presence Latarāk has seized your merchandise that you had left behind in Apum.,Suggested interval adjusted from (9-26) to end at iṣ-ba-at (token 25)
311,2.0,áš-me-ma ṭup-pá-am ša ší-bu-tim ú ší-ip-ra-am al-qé-ma a-na a-pí-im i-li-ik-ma lu-qú-tám ú-ší-ir-ma a-bi-we-du-um i-ra-dí-a-ku-um,When I heard it I availed myself of a tablet of the Elders and a messenger who went to Apum and obtained the release of the merchandise and Abī-wēdum is now leading that to you.,Interval (26-39) confirmed
312,3.0,be-et-kà URUDU KÙ.GI ú-ṣú-ra-num ta-da-nam lá i-mu-a um-ma šu-ut-ma ša-qú-ul,As for your house Uṣurānum refuses to give either copper or gold saying: 'All has already been paid'.,Interval adjusted to include the quote closing at ša-qú-ul (token 49)
313,4.0,ba-pí-ra-am ša ša-ku-ul-tim ú ku-ku-ba-tim É DAM.GÀR ni-il₅-qé-ma a-na DAM ili₅-ba-ni ni-dí-in,From a merchant we borrowed beer bread for the banquet and for drinking flasks and we gave them to Ilī-bāni's wife.,Interval adjusted to (50-61)
314,5.0,mì-ma li-ba-kà lá i-pá-ri-id,There is absolutely no reason to get nervous.,Interval adjusted to (62-65)
315,6.0,ki-ma a-wi-lu-tí-kà lu-qú-ut-kà a-na KÙ.BABBAR ta-e-er-ma tí-ib-a-ma a-tal-kam,Gentleman as you are convert your merchandise into silver and come immediately here.,Interval adjusted to (66-73)
316,7.0,a-ḫi a-ta tí-de₈-e ki-ma KÙ.BABBAR 1 GÍN ša qá-tim a-na ša-ku-ul-tim <gap>,My dear brother realize that every single shekel of silver at hand [will be used?] for the banquet.,Interval (74-87) including gap
317,8.0,TÚG.ḪI.A <gap> BA <gap>,<gap> textiles <gap> <gap>,Damaged portion of tablet; content unclear
318,9.0,a-šur-lá-ma-sí qí-bi₄-ma KÙ.BABBAR šé-bi₄-lá-ma li-ba-am dí-nam,Tell Aššur-lamassī: 'Send the silver (and so) encourage us'!,Interval adjusted to (90-95)
319,10.0,ší-im SIG₅ a-na a-šur-ṣú-lu-lí dí-in,Let him give the yield of his textiles of good quality to Aššur-ṣululī.,Interval adjusted to (96-100)
320,11.0,li-bu-šu lá tù-lá-ma-an,Do not make him angry.,Interval adjusted to (101-103)
321,476e6eef-f0a4-44fd-b3f8-65e6337a9a51_0,1.3333 ma-na 2 GÍN KÙ.BABBAR a-šu-mì ku-li-a DUMU a-lá-bi-im a-na a-šur-ma-lik DUMU ku-ra-ra-áš-qúl,1 1/3 mina and 2 shekels of silver on behalf of Kuliya son of Ali-abum I paid to Aššur-mālik son of Kurara.,Tokens 1-13; suggested interval correct
322,476e6eef-f0a4-44fd-b3f8-65e6337a9a51_1,DINGIR-li KÙ.GI ša ili₅-pì-ú-ṣur ú ṭup-pá-am ḫa-ar-ma-am ša 1.6666 ma-na KÙ.BABBAR ša ḫu-bu-ul ku-li-a a-mur-{d}UTU ú e-na-a-šùr a ša-pár-tim ú-kà-al,The golden gods of Ilī-pī-uṣur and an encased tablet of 1 2/3 mina of silver being the debt of Kuliya Amur-šamaš and Ennam-Aššur I hold as pledge.,Tokens 14-33
323,476e6eef-f0a4-44fd-b3f8-65e6337a9a51_2,i-na a-lá-ak DUMU a-na-<gap> ú MAŠKIM ša ì-lí-pí-ú-ṣur KÙ.BABBAR i-ša-qú-lu-ni-ma i-li ú-ša-ar,When Ana .......'s son and Ilī-pī-uṣur's attorney come here they will pay me the silver and I will release the gods.,Tokens 34-45
324,476e6eef-f0a4-44fd-b3f8-65e6337a9a51_3,ša DUB-pá-am i-mu-a-at,As for the tablet it will be cancelled.,Tokens 46-48
325,476e6eef-f0a4-44fd-b3f8-65e6337a9a51_4,šu-ma KÙ.BABBAR lá iš-ta-aq-lu KÙ.BABBAR ú ṣí-ba-sú a-li ni-na-mu-ru ku-li-a i-ša-qá-lam,Should they not pay the silver then Kuliya will pay me the silver and the interest on it wherever we meet.,Tokens 49-59
326,476e6eef-f0a4-44fd-b3f8-65e6337a9a51_5,ITU.KAM kán-mar-ta li-mu-um a-šùr-SIPA DUMU ì-lí-e-mu-qí,Month IX eponymy of Aššur-rē'ī son of Ilī-emūqī.,Tokens 60-65
327,476e6eef-f0a4-44fd-b3f8-65e6337a9a51_6,i-nu-mì KÙ.BABBAR áš-qú-lu e-na-a-šùr ú a-mur-{d}UTU DUMU ili₅-pì-ú-ṣur be-ru-ú i-zi-zu,When I paid the silver Ennam-Aššur and Amur-Šamaš son of Ilī-pī-uṣur acted as bērū.,Tokens 66-75
328,476e6eef-f0a4-44fd-b3f8-65e6337a9a51_7,IGI a-šur-ma-lik IGI sú-kà-li-a IGI ma-num-ba-lúm-a-šur,In the presence of Aššur-malik of Sukkalia of Mannum-bālum-Aššur.,Tokens 76-81
329,4780f8e1-2abb-4ce1-9f17-a6b21ba8819c_0.0,um-ma a-mur-IŠTAR-ma a-na ku-li-a qí-bí-ma,"Thus [Amur]-Ištar, to Kuliya:",Tokens 0-4; interval correct
330,4780f8e1-2abb-4ce1-9f17-a6b21ba8819c_1.0,a-dí ma-lá ú ší-ni-šu a-šu-mì {d}MAR.TU-ba-ni pá-ší-ri-a a-ša ším TÚG.ḪI-tí-a áš-pu-ra-kum a-ta mì-ma-ša-ma úz-ni lá ta-pá-té,"Several times I wrote you concerning my retailers Amurrum-bāni because of the price of my textiles, but you have never sent me any information!",Tokens 5-20; interval suggested ends at 22 but content fits ending at 20
331,4780f8e1-2abb-4ce1-9f17-a6b21ba8819c_2.0,a-na-ku a-na-kam a-na ku-a-tim na-aḫ-da-ku a-ta u₄-ma-kál ḫu-ša-ḫa-ka lá té-zi-ib-ma a-na i-a-tim lá ta-na-ḫi-id ak <gap>,"I here have concern for your interests, but you have never, not even for a single day, sacrificed your own interests to care for mine!",Tokens 21-36; interval suggested 22-37; adjusted to include a-na-ku
332,4780f8e1-2abb-4ce1-9f17-a6b21ba8819c_3.0,KÙ.BABBAR ším <gap> lu a-šur-e-nam <gap> šál-ma-a-šur <gap> lu {d}MAR.TU-ba-ni <gap> KÙ.BABBAR ša-áš-qí-il₅-ma ú {d}MAR.TU-ba-ni ṭur₄-dam,"[........] silver, the price paid for [my textiles], make both Aššur-ennam [......... Šali]m-Aššur [......] and Amurrum-bāni pay that silver and send Amurrum-bāni to me.",Tokens 37-52; interval suggested 37-65; shortened as next segment content begins at 53
333,4780f8e1-2abb-4ce1-9f17-a6b21ba8819c_4.0,šu-ma KÙ.BABBAR-pì i-ma-šu-ḫu té-er-ta-kà li-li-kam-ma úz-ni pí-tí,Send me a message if they try to rob me of my silver and keep me informed.,Tokens 53-59; interval suggested 65-73; significantly adjusted to match content
334,4780f8e1-2abb-4ce1-9f17-a6b21ba8819c_5.0,1 ma-na KÙ.BABBAR a-šùr-ba-ni DUMU i-dí-a-bi-im ḫa-bu-lam KÙ.BABBAR ša-áš-qí-il₅ šu-ma šé-bi₄-lam,"Aššur-bāni, son of Iddin-abum, owes me 1 mina of silver, make him pay and send it to me.",Tokens 60-70; interval suggested 73-84; adjusted to match content
335,4780f8e1-2abb-4ce1-9f17-a6b21ba8819c_6.0,1 ma-na KÙ.BABBAR i li-bi a-šùr-e-nam DUMU <gap>-mì-ma i li-bi-šu i-šu-ú {d}UTU-e-nam ṣú-ḫa-ri-im ša a-šùr-e-nam ù ša i li-bi šál-ma-a-šùr ša-áš-qí-il₅-šu-nu,"One mina of silver is owed by Aššur-ennam, son of ........, whatever is owed to me by him, by Šamaš-ennam, the servant of Aššur-ennam, and what is owed by Šalim-Aššur, make them pay!",Tokens 71-91; interval suggested 84-92; adjusted to start at token 71
336,0.0,2.5 ma-na KÙ.BABBAR ṣa-ru-pá-am i-ṣé-er PUZUR₄.IŠTAR DUMU dan-a-šur a-šur-iš-ta-kál i-šu,Puzur-Ištar son of Dan-Aššur owes 2.5 minas of refined silver to Aššuriš-takal.,Interval adjusted to include i-šu as part of the debt clause
337,1.0,ITU.KAM ku-zal-le,Month Kuzallu,Interval shifted: token 11-12
338,2.0,li-mu-um a-šur-i-mì-tí ma-lá-ḫu-um,eponymy Aššur-imittī the skipper.,Interval 13-15
339,3.0,a-na 3 ITU.KAM i-ša-qal,He is to pay within 3 months.,Interval 16-19
340,4.0,šu-ma lá iš-qú-ul ki-ma a-wa-at kà-ri-im ṣí-ib-tám ú-ṣa-áb,if he has not paid (in time) he shall add interest according to the rule of the colony.,Interval 20-27
341,5.0,KÙ.BABBAR a-le-e ni-na-mu-ru-ú i-ša-qal,He is to pay the silver wherever we meet.,Interval 28-31
342,6.0,IGI ṣí-lu-šu-da-ga-an DUMU IŠTAR-pí-lá-aḫ IGI a-lá-ḫi-im DUMU ša-lim-a-šur,Witnessed by Ṣilluš-Dagān son of Ištar-pilah by Ali-ahum son of Šalim-Aššur.,Interval 32-39
343,4a1ecde0-c0f0-4170-a0bf-bc8fc0c997a9_0,15 ma-na URUDU ma-sí-a-am i-na áb-na-tí-ni i-na ṣé-er ú-na-bi₄ ú a-ší-a-at lu-zi i-šu iš-tù ḫa-mu-uš-tim ša a-mu-ru-um-ba-ni ú a-šur-na-da a-na 4 ḫa-am-ša-tim i-ša-qú-lu,"Unabi and Ašiat owe 15 minas of washed copper, weighed with our stones, to Luzi. Reckoned from the week of Amurrum-bāni and Aššur-nādā they must pay within 4 weeks.",Segment 0.0: suggested interval (13-30) adjusted to capture full debt and payment schedule clause (tokens 0-22)
344,4a1ecde0-c0f0-4170-a0bf-bc8fc0c997a9_1,šu-ma lá iš-qú-lu ki-ma a-wa-at kà-ri-im ṣí-ib-tám ú-ṣú-bu,"If they have not paid (in time), they must add interest according to the rule of the colony.",Segment 1.0: penalty clause tokens 23-30; interval adjusted slightly from (30-33)
345,4a1ecde0-c0f0-4170-a0bf-bc8fc0c997a9_2,i-na pu-ru-uš-ḫa-dim URUDU-am i-ša-qú-lu,They must pay the copper in Purušhaddum.,Segment 2.0: place of payment tokens 31-34; interval (33-43) adjusted
346,4a1ecde0-c0f0-4170-a0bf-bc8fc0c997a9_3,ITU.KAM ḫu-bu-ur li-mu-um i-dí-a-bu-um IGI i-dí-a-bi₄-im DUMU i-tur₄-DINGIR,"Month hubur, eponymy Iddin-abum. Witnessed by Iddin-abum son of Itūr-ilī.",Remainder: date and witness formula
347,0.0,KIŠIB a-šùr-DU₁₀ DUMU a-ḫu-wa-qar KIŠIB šu-a-nim DUMU a-ki-a-nim KIŠIB a-šur-du-gul DUMU im-da-ḫi KIŠIB a-šur-DU₁₀ DUMU i-dí-ba-ni,Seal of Aššur-ṭāb son of Ahu-waqar seal of Šu-Anim son of Akiānum seal of Aššur-dugul son of Imdī-ahī seal of Aššur-ṭāb son of Idi-bāni,Four seal witnesses listed
348,1.0,12 GÍN KÙ.BABBAR i-ṣé-er a-šùr-DU₁₀ DUMU i-dí-ba-ni en-na-sú-in i-šu,Ennam-Suen has a claim of 12 shekels of silver on Aššur-ṭāb son of Idi-bāni,Debt clause
349,2.0,ITU.KAM na-ar-ma-ak-a-šur,month II / III,Month reference; interval slightly adjusted to include month name
350,3.0,li-mu-um e-lá-li DUMU i-ku-nim,eponymy of Elalī son of Ikūnum,Eponym date
351,4.0,ṣí-ib-tám ki-ma a-wa-at kà-ri-im kà-né-eš ú-ṣa-áb,He will add interest according to the regulation of of the Kanesh colony,Interest clause
352,4b488358-7f70-408a-b5a3-860627e05b6d,a-na a-dí-da a-lá-ḫi-im ú ú-ku qí-bi-ma um-ma PUZUR₄-a-šur-ma,To Adida, Al-aḫum and Uku from Puzur-Aššur:
353,4be87c06-aa69-4f7c-8ed3-c384dfffe88a_0.0,a-na a-dí-dá a-lá-ḫi-im ú ú-ku qí-bi₄-ma um-ma PUZUR₄-a-šùr-ma,To Adida, Al-aḫum and Uku from Puzur-Aššur:
354,4bfc19b2-851a-4efd-9982-57b41298303a_0,a-na ku-li-a a-šur-lá-ma-sí ù a-šur-lá-ma-sí-ma qí-bi-ma um-ma a-šur-e-mu-qí a-na a-šur-lá-ma-sí DUMU PÚZUR-ì-lí-qí-bi₄-ma,"To Kuliya, Aššur-lamassī and Aššur-lamassī, thus says Aššur-emūqī, to Aššur-lamassī, son of Puzur-ilī in particular:","Envelope address and sender formula; suggested interval (0,13) adjusted to end before token 12 (3 GÍN)"
355,4bfc19b2-851a-4efd-9982-57b41298303a_1,3 GÍN KÙ.BABBAR iš-tù li-mì-im a-šur-ma-lik DUMU šu-ḫa-ni-iš a-dí-na-kum,"You have 3 shekels of silver, given by me, since the eponymy of Aššur-mālik, son of šu-Haniš.","Interval (13,21) corrected to start at token 12; a-dí-na-kum closes the clause"
356,4bfc19b2-851a-4efd-9982-57b41298303a_2,um-ma a-ta-ma 3 TÚG ša ṣú-ùḫ-ri-im ša a-ki-dí-e iš-tù a-lim{ki} ú-šé-lá-a-kum,You said: I will bring up for you from the City 3 Akkadian garments for children.,Direct speech introduced by um-ma a-ta-ma
357,4bfc19b2-851a-4efd-9982-57b41298303a_3,TÚG.ḪI.A tù-šé-li-a-ma a-ni-ša-am lá té-ta-ar-ba-am ḫa-ra-kà ta-ta-lá-ak,"You brought these textiles up, but did not enter here with me, you went away on a journey.",Three short clauses describing the action and departure
358,4bfc19b2-851a-4efd-9982-57b41298303a_4,a-ḫi a-ta be-lí a-ta 3 TÚG.ḪI.A ša ṣú-ùḫ-ri-im ša tù-šé-li-a-ni a-na ku-li-a dí-in,"Please my brother, my lord, give these three garments for children that you brought up (from Assur) to Kuliya.",Petition formula with a-ḫi a-ta be-lí a-ta
359,4bfc19b2-851a-4efd-9982-57b41298303a_5,šu-ma TÚG.ḪI.A ta-ad-nu KÙ.BABBAR ší-im-šu-nu ú-sí-im-ma a-na ku-li-a dí-in,"If these garments have already been sold, establish how much silver they yielded and give it to Kuliya.",Conditional clause with šu-ma
360,4bfc19b2-851a-4efd-9982-57b41298303a_6,a-ḫi a-ta IGI a-šur a-kà-ra-ba-ku-um,"(Then) my dear brother, I will pray for you before Aššur.","Closing formula of first section; short segment fits interval (61,66)"
361,4bfc19b2-851a-4efd-9982-57b41298303a_7,a-na a-šur-lá-ma-sí ma-ri-a qí-bi₄-ma a-na-kam ta-áp-nu-a-ma um-ma a-ta-ma KÙ.BABBAR 1 GÍN a gám-ri-a dí-na-ma ší-a-ma-tí-šu lu-šé-bi-lá-kum,Say to my son Aššur-lamassī: Here you turned to me saying: Give me a little silver for my expenses and I will send you the merchandise it yields.,New address section; direct speech embedded within
362,4bfc19b2-851a-4efd-9982-57b41298303a_8,KÙ.BABBAR a-dí-na-kum ù ša 8 GÍN KÙ.BABBAR SÍG.ḪI.A ú ú-kà-pè a-dí-na-kum um-ma a-na-ku-ma zi-ra-am a-na ma-ma-i-im ḫa-bu-lá-ku ú-ul zi-ra-am ú-ul sú-ub-ra-am šé-bi₄-lam,"I did give you silver and also wool and saddlecloths for a value of 8 shekels of silver, saying: I owe a cauldron to the man of Mamma, therefore send me a cauldron or a slave.",Long clause with um-ma a-na-ku-ma introducing inner speech; suggested interval end 108 is erroneous (text only has ~107 tokens)
363,4bfc19b2-851a-4efd-9982-57b41298303a_9,iš-tù MU.2.ŠÈ KÙ.BABBAR-pì ta-,It is now two years that you manage my silver.,Text breaks off here; tablet damaged; ta- is the beginning of a verb form (ta-[ṣa-ba-at] or similar)
364,4bfc19b2-851a-4efd-9982-57b41298303a_10,[...],[Be so kind as to give to Kuliya that silver or what has been acquired for it during its journey.],Text is broken/missing; the translation is restored from context; no transliteration survives for this segment
365,0.0,2 GÍN KÙ.KI ku-pu-ur-ší-ni-IN SIG₅ i-ṣé-er im-lik-a-šùr ir-ma-a-šur i-šu,2 shekels of -gold of fine quality Imlik-Aššur owes to Ir'am-Aššur.,Suggested interval starts at 3 but tokens 0-2 (2 GÍN KÙ.KI) belong to this clause; adjusted start to 0. The name ku-pu-ur-ší-ni-IN in guide translation appears to be a misreading; high-quality translation omits it as a separate debtor.
366,1.0,iš-tù ḫa-IR-uš-tim ša e-dí-na-a a-na 15 ḫa-am-ša-tim i-ša-qal,From the week of Edināya he will pay within 15 weeks.,Interval 9-23 adjusted to 9-16 to end at i-ša-qal.
367,2.0,šu-ma lá ìš-qúl ki-ma a-wa-at kà-ri-im ú-ṣa-áb,If he does not pay he will add (interest) in accordance with the regulation of the colony.,Interval 23-30 adjusted to 17-23; ú-ṣa-áb closes the conditional clause.
368,3.0,ITU.KAM qá-ra-a-tim li-mu-um e-lá-lí DUMU i-ku-nim IGI pí-lá-aḫ-a-šur DUMU da-nu-um-ì-lí IGI a-šur-ma-lik DUMU a-zu-za,Month VIII year eponymy of Elālī son of Ikūnum. In the presence of Pilah-Aššur son of Dannum-ilī of Aššur-mālik son of Azuza.,Covers date formula and witness list tokens 24-37.
369,4d3941a4-d04e-439f-ba7f-734e0b5f8154_0.0,15 GÍN KÙ.BABBAR i-ṣé-er ma-lá-wa-áš-ḫe DAM.GÀR i-šu,15 shekels of silver Malawašhe owes to the creditor.,Interval slightly adjusted; segment covers the debt statement up to i-šu; guide translation references same content
370,0.0,a-na ku-li-a qí-bi-ma um-ma ḫu-na-ḫu-na,To Kuliya thus says Hunahuna:,Standard epistolary opening
371,1.0,a-na-aḫ-DINGIR ú PÚZUR-a-šur i-li-ku-nim,Anah-ilī and Puzur-Aššur came here.,Verbal form i-li-ku-nim = ventive perfect
372,2.0,KÙ.BABBAR 1.3333 ma-na KÙ.BABBAR ša a-na-aḫ-DINGIR i-ḫi-ib-lu PÚZUR-a-šur áš-ra-kam-ma 14 GÍN KÙ.BABBAR ip-ta-an 1 ma-na 6 GÍN KÙ.BABBAR a-na ša-ni-im pá-qí-id,As for the silver the 1 1/3 mina of silver for which Anah-ilī had become indebted over there Puzur-Aššur consumed (for) 14 shekels of silver (the rest) 1 mina 6 shekels has been entrusted to somebody else.,Long financial accounting clause
373,3.0,um-ma a-na-aḫ-ì-lí-ma DUB ša ku-nu-ki-a bi-lá-nim-ma KÙ.BABBAR li-qí-a,Anah-ilī said: Bring me the tablet with my seal then take the silver.,Direct speech introduced by um-ma
374,4.0,DUB a-na-ku lá a-mu-a ú-šu-ra-am,But I refused to release that tablet.,Negated verb a-mu-a with ú-šu-ra-am
